Username,Comment,date,Ticker,sentiment
CryMeATicker,for the love of god and a tenuous belief in the human race I m go to go with these guy be just jerk chain they get no fact to support any of their slop so this be the cynical last stop I pray this be the case or we be rapidly deevolve as a species ,2024-10-10,DJT,1
spnst,seem like each day more and more in the gop be get sick of trump lie,2024-10-10,DJT,1
VikeInvests,you need an illustration ,2024-10-10,DJT,3
lifeisverygood,melania so sorry like you be many other forget by ignorance,2024-10-10,DJT,1
RNinvest,the beconfident guy,2024-10-10,DJT,5
RNinvest,I can not believe people be this stupid,2024-10-10,DJT,1
minnesota,they stir um in with trump magic marker ,2024-10-10,DJT,1
Chipwars,never believe trump lie,2024-10-10,DJT,1
VikeInvests,weird right ,2024-10-10,DJT,5
CryMeATicker,dude you be go full maga no one go full maga ,2024-10-10,DJT,1
PrincessKissyface,yeah how seriously how be a political party cause hurricane love to hear a wellfounded case here,2024-10-10,DJT,1
beconfident,her democrats create weather comment be not that surprising remember this jewel of insanity ,2024-10-10,DJT,3
ForeRight5,its get to the point where some people should not be allow to vote without an iq test,2024-10-10,DJT,4
sborovay07,as the deep state get desperate as they see another steal be not in the card and the p diddy vid expose their puppet be about to hit haarp be at work create disastrous weather on the east coast I m in ca so I would not be surprised of a major earthquake prior to the election still on the table to cancel an election be the infiltration in major city of 18 million illegal military age man bring to we and sponsor from within by our government,2024-10-10,DJT,1
havacubepunch,trump ,2024-10-10,DJT,5
havacubepunch,for ,2024-10-10,DJT,4
havacubepunch,prayer ,2024-10-10,DJT,5
TomKirk222,trump go to win mean america be go to win the lunatic on here hate that because most of they on here be not even american the rest who be mostly immigrant who come here and be not real americans and have no deep root at all they do not care about this place they can not take you to their grandparent grave in a nearby town because its in a foreign country somewhere else some shole place they want to emulate why be they like that its just their nature,2024-10-10,DJT,1
GorillaTicTacs,if you re not make money taxis just be not an issue trump economic plan pretty much guarantee be go to shit not sure if anyone I know have million in dividend payment a year anyways ,2024-10-10,DJT,1
jaydeedoo,lmao,2024-10-10,DJT,3
jrocket87,republicans be say that the hurricane be a democrat hurricane lol ,2024-10-10,DJT,1
GorillaTicTacs,seriously short borrow rate be down to just 1 apr now on this they re try hard to get people to borrow share and can not do it ,2024-10-10,DJT,1
FrankieSmilez,elon take thing to farwe all know he want that to happenthis billionaire think he can do whatever he want,2024-10-10,DJT,1
beconfident,because we do not make 100 million dollar ,2024-10-10,DJT,1
Chipwars,go down like trump on putin ,2024-10-10,DJT,1
jbird229,consider there be a lot of anti trumper in here unless the account be the same person why would anyone be ok with kamalas taxation on unrealized gain do you really think this would not effect employment or the stock market itself not try to trigger so actual answer please ,2024-10-10,DJT,1
perennialperikneeum,apparently they be do with the hypochristian bullsht that you keep try to elevate prayer really do any of you drumpf supporter really believe your bible I remain gasted of flabber regard your support of an entity that totally desecrate I repeat totally desecrate everything that the bible teach wtf be it with you all,2024-10-10,DJT,1
ParaboliCoin,kamala and biden be the reason why fl be face so many catastrophic hurricane this year we need change vote trump ,2024-10-10,DJT,1
Pigfat,under tomorrow and head back to low teen next week,2024-10-10,DJT,2
jrocket87,republicans party right now ,2024-10-10,DJT,5
beconfident,republicans be murderer ,2024-10-10,DJT,1
The_Swing_Trader,as independent presidential candidate robert f kennedy jr ramp up effort to secure ballot access in all 50 state he face stiff resistance from democratic political opponent attempt to block his november election bid with multiple lawsuit yes folk witness the filth of the democrat party as malcolm x say any black who vote for a democrat be not only a chump but a traitor to their race good night,2024-10-10,DJT,1
Urbanomics,trump god bless the usa bible be make in china ,2024-10-10,DJT,1
SillyStrings5150,fox news chad pergram tweet that the network receive a fact sheet that be put together by republican of the house appropriations committee about disaster aid he say the fact sheet state that fema have enough funding in the shortterm to address immediate need for both hurricane helene and hurricane milton it also note that there be no funding connection between the migrant shelter program and the disaster relief fund accord to pergram it add there be no intermingling of funding between these two program it add that the only connection be that both program be administer by fema pergram write on social medium platform x fema have a webpage up debunk misinformation and other false claim where it say disaster relief fund money have not be divert to other nondisaster relate effort ,2024-10-10,DJT,1
beconfident,the administration continue to actively preposition lifesave resource in advance of hurricane milton include 156 million meal and 139 million liter of water in position 20 million meal and 40 million liter of water ready to be deploy as need seven fema incident management assistance team us army corps of engineer temporary power team three us coast guard swift water rescue team eight fema urban search and rescue team five disaster medical assistance team ,2024-10-10,DJT,4
beconfident,the new king of misinformation ,2024-10-10,DJT,1
SillyStrings5150,fox have proof trump be lie about fema funding,2024-10-10,DJT,1
beconfident,even republicans be come out call out idiot like you that spread lie and cause chaos ,2024-10-10,DJT,1
SillyStrings5150,florida republicans who vote against funding fema be now face disaster roll stone,2024-10-10,DJT,1
Bazzzigar,one month high amazingfrom ,2024-10-10,DJT,5
AndrewLonggg,break american hospital perform nearly 14000 child sx change from 2019 to 2023 for which doctor submit charge of around million a figure likely underestimate as the analysis could not account for claim from certain insurance company or cash payment,2024-10-10,DJT,1
GorillaTicTacs,I love how they have no idea how military aid work exactly ,2024-10-10,DJT,5
Bazzzigar,volume pick up ,2024-10-10,DJT,5
beconfident,republican be murderer why be maga republicans spread lie about hurricane disaster recovery perhaps its to cover up the fact that just two week ago 100 gop lawmaker vote against additional fema funding ,2024-10-10,DJT,1
machumble,mi and my beautiful state of wi could be the big upset to democrats pa I think will go trump as well,2024-10-10,DJT,3
beconfident,hurricane helene victim be reportedly be pricegouge on essential like food and fuel some state have law to stop this but many do not this be why we need a federal ban in place like the one kamala harris have propose so all americans be protect ,2024-10-10,DJT,1
perennialperikneeum,and we be still await a coherent response from wait for it the dreamweaver they call it ramble but I m really weave honest I m weave,2024-10-10,DJT,2
CryMeATicker,well maga worm get to lot of wiggle hard to scoop em up all at once just like the drip drip drip of jan 6 arrest they ll get around to it ,2024-10-10,DJT,4
merryingalong,all magas ,2024-10-10,DJT,3
The_Swing_Trader,ftc get troubling report of price gouging for essential ahead of hurricane milton I think harris be go to stop this sort of thing oh well I m sure she try,2024-10-10,DJT,1
CryMeATicker,jim just add to the maga chaos he s get nothing factual to say so he s just do maga funny american democracy be at stake but he make a funny ,2024-10-10,DJT,3
beconfident,get this the four large meatpacker control over 80 of the beef market mcdonald be now sue they for conspire to artificially inflate beef price this be how you know monopolization in the meat industry be truly bad hello ,2024-10-10,DJT,1
sKamalaRCX2017,hmmmm weird ,2024-10-10,DJT,3
HuskyNutBuster,its kinda like trumper have a stroke over the fake story of immigrant eat duck from a pond but do not bat an eye when kid get shoot up at a school,2024-10-10,DJT,3
soulbrotha,I guess trump can break out his magic marker ,2024-10-10,DJT,3
thewittywasp,only way to get help ,2024-10-10,DJT,4
DharmaPatrol,delusional donnie say about gaza I ve be there he have not magatard be fine with this but freak out about kamala need to prove she work at mcds 40 year ago time to put grandpa to bed,2024-10-10,DJT,1
CryMeATicker,peter dodge a meteorologist who work on hurricane aircraft mission spend much of his life chase huge stormsdeath be no exception on tuesday evening the hurricane hunter of the national oceanic and atmospheric administration drop mr dodge ashe into the eye of hurricane milton as the storm cross gulf water on its path to florida,2024-10-10,DJT,4
TechTrader17,you can not fix this you just have to let it crawl back under the rock and hope it do not get the chicken ,2024-10-10,DJT,1
soulbrotha,do anybody know why this retard be still broadcast ,2024-10-10,DJT,1
JenniFUR2,watch dementia joe today I think to myself man this guy be really piss off that they deep sixd he out of his job to give to cackle,2024-10-10,DJT,1
Xyzfrompartsunknown,how do maga lover with daughter rationalize their support for this man,2024-10-10,DJT,5
HuskyNutBuster,you all know putin see all this and be laugh at trump,2024-10-10,DJT,5
WallStpass,I might eat this fat bitch have he for lunch ,2024-10-10,DJT,3
CryMeATicker,trump would be in a bunker watch america burn on tv just like jan 6 next question ,2024-10-10,DJT,1
toremySo,trump vance 2024 ,2024-10-10,DJT,5
itsallaboutmoney2030,imagine a circumstance like major attack on we or extreme weather event like a large earthquake and president have to go on the street to provide the moral support who do you prefer 1 trump 2 kamala ,2024-10-10,DJT,1
Xyzfrompartsunknown,putin bombing hospital and school in ukraine and your maga lover worship he as you sit silently in the corner,2024-10-10,DJT,5
LargeMargeN,please tell I you do not actually believe this ,2024-10-10,DJT,1
FlexLuthor,do someone say sofa,2024-10-10,DJT,1
JAHBULON,no they can not ,2024-10-10,DJT,1
JustaScalper,late poll show the great blue wall be crumble this will be bad than 2016 trump win in a landslide,2024-10-10,DJT,1
channelsurfer,1364 bud win ,2024-10-10,DJT,5
CryMeATicker,its a super fail though dummy be as dummy do ,2024-10-10,DJT,1
ibhljim,duuuhhh and they can make hurricane and point they only at we too,2024-10-10,DJT,2
AndrewLonggg,soon,2024-10-10,DJT,4
CryMeATicker,billionaire love fest figure out how to far screw the work class hilarious ,2024-10-10,DJT,5
DJTNUMBERONEFAN,he will cause deceit to prosper and he will consider himself superior he will use every kind of evil deception to fool those on their way to destruction because they refuse to love and accept the truth that would save they daniel 825 2 thess 210,2024-10-10,DJT,5
TreasureBonanza,anyone who still believe russia collusion be literally sofa king we todd it ,2024-10-10,DJT,1
channelsurfer,could you show a little creativity and at least pick a new country ,2024-10-10,DJT,3
DJTNUMBERONEFAN,the antichrist rise to power will seem like a miracle that god perform trick people into follow satan instead of god without even notice the arise in power of the lawless one will be in accordance with how satan work he will use all sort of display of power through sign and wonder that serve the lie 2 thess 29,2024-10-10,DJT,5
CryMeATicker,we will not even bother to ask for source anymore because maga mean pathological lie 247 thank for post though ,2024-10-10,DJT,1
deekay99,dem be party of pedophile corrupt power hungry ahole,2024-10-10,DJT,1
WallStpass,the adult in the room ,2024-10-10,DJT,4
IHateMonie,so obvious trump be way bad than any other politician he should be in jail right now any normal person would have go to jail for organize jan 6 ,2024-10-10,DJT,1
blissfulBull,run pretty well who be buy it over 10 cent no way now touch by the orange moron and it shall turn to ashe too,2024-10-10,DJT,5
TreasureBonanza,she and the dnc pay for the fake dossier get fine and you tard still believe russia collusion lol ,2024-10-10,DJT,1
DJTNUMBERONEFAN,a despicable person will arise a man of contempt to whom the royal honor have not be rightfully confer he will slip in when least expect and will seize the kingdom through flattery and intrigue daniel 1121,2024-10-10,DJT,5
BuIl2024,long way to go ,2024-10-10,DJT,5
IHateMonie,long way to go ,2024-10-10,DJT,5
Bazzzigar,long way to go ,2024-10-10,DJT,5
TechTrader17,just california a damn ,2024-10-10,DJT,5
buffetthemuffet,pennsylvania swinge towards trump ,2024-10-10,DJT,3
DJTNUMBERONEFAN,if you follow the teaching of christ at all trump should repulse you,2024-10-10,DJT,1
merryingalong,magas ,2024-10-10,DJT,3
perennialperikneeum,those damn democrats aka demonrat to the magat faithful be manipulate the weather again curse I say curse the delusion be fill in your own response,2024-10-10,DJT,1
CoachVice,good poll you could ever have merica ,2024-10-10,DJT,5
Southern4me,voter fraud be in full gear any human can vote in california as many time as they wish since no i d be require,2024-10-10,DJT,1
wha1e,its the crazy like these folk below as to why I leave the republican party and become an independent the last republican I vote for be john mccain in 2008 when I be just 18 year old I plan to vote for trump this year a republican for the first time since 2008 at least with trump or harris either one will rack up the deficit even more which will be good for my crypto portfolio,2024-10-10,DJT,5
TechTrader17,cmon people look at this we have get to do well this be an emergency situation we can not hand our nation over to this kind of crazy this would be comical if it be not so fkn infuriate ,2024-10-10,DJT,1
BlackBerril,goosebump watch this ,2024-10-10,DJT,5
tpayne1130,at the end of trumps term there be no immigration problem because there be no job,2024-10-10,DJT,1
Southern4me,oh no,2024-10-10,DJT,1
The_Swing_Trader,huskynutbuster catch in a lie no surprise,2024-10-10,DJT,5
OrangePedoPosse,ok I think I figure this whole maga thing out its like when a girl invite her ugly girlfriend to go club with to make she look well magat hang around trump to make themselves look smart ,2024-10-10,DJT,3
The_Swing_Trader,harris the border be secure I promise joe can we hurry up and get these people register to vote yes kam ill get on it right after I finish my ice cream and have a nap,2024-10-10,DJT,1
HuskyNutBuster,the trumper who think world leader all speak every language be now ask I to name the interpreter trump and putin use to communicate because he do not believe they would use one future generation will study the ignorance of maga for century,2024-10-10,DJT,1
andreingramPhD,nail the bottom ,2024-10-10,DJT,1
Fair_Trader42,show of hand maga who buy a trump bible,2024-10-10,DJT,5
deekay99,biden hate kamala for sure,2024-10-10,DJT,5
Donald_Dwac,oh lord we ask that you guide the short through these tumultuous time as they face a stock that rise with the unpredictability of a storm give they strength to endure the relentless green wave and may their spirit remain unbroken as they navigate this wild ride help they find peace in the face of unexpected surge and let their lesson be learn with grace though the market move against they may they find light even in their loss amen ,2024-10-10,DJT,5
TreasureBonanza,one last reminder for those in the back ,2024-10-10,DJT,4
CaymanStyleBeef,if you can not dazzle um with brilliancebaffle um with stupidityshould be the maga motto ,2024-10-10,DJT,1
Chanticleer,read past the bold letter ,2024-10-10,DJT,5
USAisBetterthanMaga,its not just go to go away,2024-10-10,DJT,3
CryMeATicker,the whole maga premise be when you stand no chance of dazzle em with brilliance you just baffle em with bullshit ,2024-10-10,DJT,1
Academia,hole country,2024-10-10,DJT,4
tpayne1130,such a bad market under biden,2024-10-10,DJT,1
Str18BALTStr,people be scramble to get these kit harris say and this guy who be president of the united states be send they to russia to a murderous dictator for his personal use maga pride,2024-10-10,DJT,1
ForeRight5,not sure you know what a market maker job be actually I m 100 sure you do not know,2024-10-10,DJT,1
TechTrader17,you ve get to be fkng kid absolutely no one can be this dense I mean ffs bruh I can not even I just can not wtf ,2024-10-10,DJT,1
kamalathegreatborderCzar,kamaltoe path to victory be get very slimshe will have to win pa wi and michigan or she do,2024-10-10,DJT,2
channelsurfer,up in michigan again ,2024-10-10,DJT,5
The_Swing_Trader,here be just a single instance of the filthy lie scum in the white house this garbage stand up in front of the entire country and falsely push some ridiculous story about jussie smollett getting attack by two guy in maga hat when everyone know it be obviously a hoax that s why these two moron be know around the world as dumb and dumber,2024-10-10,DJT,1
deekay99,kamala be an illegitimate candidate and be destroy the democracy from now onward anybody will nominate next presidential candidate bypass the worthless democratic process,2024-10-10,DJT,1
ForeRight5,what do speak russian have to do with send covid equipment to putin and then lie about it and be the dumb one interesting take on reality,2024-10-10,DJT,1
perennialperikneeum,excuse I detective just one more thing what color be the sky in your world exactly,2024-10-10,DJT,1
judgeyoung2,this be what vance think he look like,2024-10-10,DJT,5
TreasureBonanza,for all the idiot still push russian collusion nonsense who seem to have no memory whatsoever ,2024-10-10,DJT,1
sailorGND,what the republican lemming can come up with on such short notice crown touch be add the picture of my african american banal kook who take trumpism to heart for what he s toast,2024-10-10,DJT,5
deekay99,biden be die to put kamala in jail for kick he on his head in basement and rob the nomination,2024-10-10,DJT,1
ybfmiami,magat really believe dem be engineer the weather omg how gullible be these people these moron believe whatever the orangutan tell they ,2024-10-10,DJT,1
The_Sandman,it look like the democrats be crank up their weather machine again smh,2024-10-10,DJT,2
TreasureBonanza,axe wasteful government program will make the government small ,2024-10-10,DJT,1
juniorminting,nothing new biden talk about trump spread fud and lie,2024-10-10,DJT,1
CarlBnas,short answer be trump be not a republican or a conservative he do not mind big government or irresponsible spending if it benefit he personally or politically,2024-10-10,DJT,1
HuskyNutBuster,good lord been get some real potato post today from the maga klan this guy do not even know what an interpreter be,2024-10-10,DJT,1
Hansgrubr,I m the next press secretary,2024-10-10,DJT,5
NerdyTraders,what be crook joe on this tv lie about now,2024-10-10,DJT,1
TreasureBonanza,elon be literally go to cut government waste and trim the fat that be literally small government in action lol ,2024-10-10,DJT,1
Neversellcheap,I be try to understand how trump want to create another agency with elon republicans use to be the party of small governmenttrump create another branch of the military with space forceok now this agency elon will be head upcongress have the purse string of the governmentwe elect these people from our district and know to be the close to the peoplei be just wonder how elon will be in charge of a agency that will in effect have the ability to supersede congress or check and balance,2024-10-10,DJT,1
DesiHFM,abki baar trump sarkar ,2024-10-10,DJT,3
secondz2late,can you imagine ,2024-10-10,DJT,5
OrangePedoPosse,dang guy willie have speak ,2024-10-10,DJT,5
Geronimo19,maga ,2024-10-10,DJT,5
buffetthemuffet,market maker will move this to 5080 range trump be become next potus ,2024-10-10,DJT,5
Zebedee100,no surprise as he barely speak english,2024-10-10,DJT,2
bb06wr,check this out tds be an epidemic,2024-10-10,DJT,1
thewittywasp,I m just chilling and drinking mojito in miami ,2024-10-10,DJT,1
HuskyNutBuster,wow great postzzzzz,2024-10-10,DJT,5
HuskyNutBuster,gettin there,2024-10-10,DJT,5
CryMeATicker,wow all those word be clearly verifiable thru this random photo great post ,2024-10-10,DJT,5
