Username,Comment,date,Ticker,sentiment
PatsOfButter,murica,2024-10-10,DJT,2
beconfident,america first ,2024-10-10,DJT,5
RagingBull4444,thank god the evil force be not able to destroy florida maybe next time false flag now let get back to north carolina ,2024-10-10,DJT,1
CarlBnas,I write I m here for it and you think I mean I m in the building recording that s the funniest thing I ve see all week,2024-10-10,DJT,5
beconfident,now its hurricane control by democrats ,2024-10-10,DJT,4
Justtakingprofits,mule season,2024-10-10,DJT,5
Justtakingprofits,charlotte old hole ,2024-10-10,DJT,4
CarlBnas,if more people care about the trans thing all these seat would be full and obviously donald care since he brag and lie about crowd size his entire career you can act like its no big deal but I do not want to hear about steal election this time when its clear the ramble old man be less popular,2024-10-10,DJT,3
starbreaker,libtard react to propagandist woodward fiction have short memory and no comprehension of diplomacy during a global crisis from early 2020 before trump allegedly return the favor with a few test kit machine,2024-10-10,DJT,1
CountGridula,one thing that genuinely do mystify I with no snark trump be one of the least masculine least adult people in public life needy whiny defensive pleading scared of woman terrify of more powerful man I m at a loss about why trump base see he as manly or alpha,2024-10-10,DJT,1
InformedReasoned,do this mean flame maggot be for electric vehicle and clean energy now ,2024-10-10,DJT,5
AndrewLonggg,yeah nobody care about empty chair in an unknown location of a multi thousand seat arena more people care about crap like this you be proud of those couple chair though,2024-10-10,DJT,1
HeyyVern,the day we stop worship wealthy and insecure nepo baby be the day america can get back to its philosophical ideal,2024-10-10,DJT,1
DMAGA,hahaha 1 million dollar,2024-10-10,DJT,1
CarlBnas,I do not know how many time I need to communicate that I do not have x but these seat be indeed empty and this be a screenshot of a video where he s talk so there s no excuse for this other than he s less popular than he be before when he barely win an election this be my warning ignore it if you wish,2024-10-10,DJT,1
CarlBnas,weirdo just discover the medium,2024-10-10,DJT,4
AndrewLonggg,here you go champ,2024-10-10,DJT,5
perennialperikneeum,and by god he swear mexico will pay for it this asswipe be too infantile for further consideration,2024-10-10,DJT,1
CryMeATicker,embarrassing to post a paper know as a tabloid rag own by a foreign billionaire who do not give a rat ass about you or your future ,2024-10-10,DJT,1
soulbrotha,so if the democrats control the weather why do they send a hurricane right up i4 to tampa bay and orlandoboth hillsborough and orange county go democrat overwhelmingly in both 2016 and 2020 ,2024-10-10,DJT,2
perennialperikneeum,reagan be a precursor to the nonparty that the gqp have devolve,2024-10-10,DJT,1
tuningin,everyone know this valuation be a fantasy it will catch up soon than later ,2024-10-10,DJT,5
CarlBnas,my bad you re right there s totally people in these seat I m mistaken or have a vision problem,2024-10-10,DJT,1
kamalathegreatborderCzar,stay strong libtard there be always the popular vote,2024-10-10,DJT,5
CryMeATicker,yeah not so much the cognitive dissonance of feel terrible for vote orange in 2016 lead repub over it to just pull the harris lever in private to avoid the crazy maga talk back ,2024-10-10,DJT,1
perennialperikneeum,and that fully explain the drumpf euphoria,2024-10-10,DJT,5
Justtakingprofits,michael milken and donald trump have what on common this be test for those who still have some tooth ,2024-10-10,DJT,4
kamalathegreatborderCzar,here be pennsylvania libtard,2024-10-10,DJT,5
CarlBnas,do that erase all the empty seat nope,2024-10-10,DJT,1
DMAGA,you should definitely have dark maga in your portfolio go though october november take a look at the chart and unusual volume 1b circulate supply,2024-10-10,DJT,3
jim10011,just mail my ballot disgust with the choice but harris get my vote I do not like she and do not think she s ready to be president but she s well than the alternative ,2024-10-10,DJT,2
GuyC22,wrong poll be miss secret trump voter he always under perform in the poll just like in 2016 and 2020,2024-10-10,DJT,1
CryMeATicker,another non source maga fantasy poll ,2024-10-10,DJT,1
kamalathegreatborderCzar,here be wisconsin now libtard,2024-10-10,DJT,5
CarlBnas,maga be about to be in for a rude awakening and I m here for it,2024-10-10,DJT,4
tikibar51,hurricane sandy help propel obama to the presidency in 2012 helene and milton could have the opposite effect for kamala from what I have see so far neither biden nor harris have the intellectual fortitude and common sense to handle hurricane as obama do ,2024-10-10,DJT,3
kamalathegreatborderCzar,here be arizona libtard,2024-10-10,DJT,5
SillyStrings5150,fox news be have to factcheck its own anchor on hurricane lie the new republic,2024-10-10,DJT,1
ForeRight5,if you think this be real you re a hillbilly,2024-10-10,DJT,1
SillyStrings5150,doorknocker poll be miss secret harris voter who will reject trump,2024-10-10,DJT,1
Sadie_Adler,that s if trump win as folk here be predict it will get there much fast if he lose ,2024-10-10,DJT,3
CryMeATicker,keep post the same unsourced fantasy meme ,2024-10-10,DJT,1
Sadie_Adler,I can not wait until the election be over ,2024-10-10,DJT,1
Chanticleer,be this an article about climate change ,2024-10-10,DJT,4
Garymoneybag,you do not have to like he you just know that he s the well choice,2024-10-10,DJT,5
aa906814,well look what we have here do not think I d see this ,2024-10-10,DJT,5
SammyStocks22,haha he s hate by liz cheney republicans try again ,2024-10-10,DJT,1
TrumpISaTurdSandwich,thank god trump be go to lose so bigly he s soooo unliked and hate even by republicans only maga wack job like he,2024-10-10,DJT,1
Garymoneybag,oh like this,2024-10-10,DJT,5
BuIl2024,pray for all the republican voter in fl right now as milton make landfall in trump we trust ,2024-10-10,DJT,5
Stocktrader1234,1st,2024-10-10,DJT,5
MagnaHov81,today we see the most buy volume ever with that be say hold on bc we be about to take tf ,2024-10-10,DJT,5
Stocktrader1234,4 year be enough of djt even republicans be of his maga bs,2024-10-10,DJT,1
IBOTTheDipAndTheDipWon,think I d drop this here to trigger the antitrump crowd,2024-10-10,DJT,1
Wiilnitbesuspendedsorry,faux say trump be a behind in pa,2024-10-10,DJT,1
PeterLynch_IsBack,fkh ,2024-10-10,DJT,5
Wiilnitbesuspendedsorry,still here try again,2024-10-10,DJT,4
StockRavingMad,ok grandpa time for your medicine,2024-10-10,DJT,3
swingprotrades,read and weep you f libtards ,2024-10-10,DJT,5
Str18BALTStr,as the market set new alltime high record the last thing we need be chaos donny screw it up ,2024-10-10,DJT,5
Stocktrader1234,djt name be mention at least 312 time in the project 2025 jdvance write the forward to the project project 2025 book very interesting either djt jdvance maga be really not let his base know that project 2025 be go to hurt a whole lot of you too really really,2024-10-10,DJT,3
loboxr2d2,how do you feel about that ,2024-10-10,DJT,5
thewolfoflancaster,another disgrace member of the maga cult who throw away their life to spread trump lie million that s what this scumbag deserve for destroy the life of innocent poll worker,2024-10-10,DJT,1
swingprotrades,here be georgia libtard ,2024-10-10,DJT,5
OrangeDirt,trump be such a liar he actually try to say he be the one that lower insulin cost to 3500 a month talk about be a complete idiot ,2024-10-10,DJT,1
soulbrotha,the need for birth control be real ,2024-10-10,DJT,5
loboxr2d2,I mean its like every day its a controversy of some kind with he do not you all have enough already ,2024-10-10,DJT,3
Veryn_ice_howmusk,remember he have a 10 yr contract with angel studio to make movie and be tell brad parscale if they work together in the near future will be apart of this marketing listen to 5747 to hear about brad do the marketing for sound of freedom new movie ,2024-10-10,DJT,1
Johnniejohns,break wind ,2024-10-10,DJT,1
MelonHole888,as I be say the floridan be not leave voting red no matter the dem plan to scare and make they leave be not work they will risk their life smoke out of a bong in hurricane its happen folk ,2024-10-10,DJT,1
CoIumbo,jan 6th protester go to prison democrat who try to stop the peaceful transfer of power in an effort to overthrow the usa have all charge drop,2024-10-10,DJT,1
Chanticleer,I hope those be not the same prayer you use for school shooting because those do not seem to work ,2024-10-10,DJT,2
loboxr2d2,do anyone watch this at all the guy be fry who be behind this eld abuse,2024-10-10,DJT,1
Forthill,level of stupidity be staggering,2024-10-10,DJT,1
USAisBetterthanMaga,meanwhile in south florida,2024-10-10,DJT,3
CoIumbo,lets not forget hatians eat cat here be proof but the medium will not show it to the american public for some reason,2024-10-10,DJT,3
Chanticleer,wow what a well think out argument my mind be change ,2024-10-10,DJT,5
22Shares,those who control the weather will control the world vice president lyndon b johnson 1962 our prayer be with you florida ,2024-10-10,DJT,5
AndrewLonggg,send job over see destroy men purpose and family it be replace with opioid and other addiction destroy america trump will bring production back,2024-10-10,DJT,1
ScooterMicBooter1984,fake news all you cnn lib be fake news commie trump always win god always win the devil be already defeat ahahahahahahhhhhhahahahahahhaahahahahahhhhhhhhhhhahhhhhhhhhaahhh trump win again ,2024-10-10,DJT,1
Honest_Abe,cloud seeding go wrong,2024-10-10,DJT,1
Calicodered,some day I wonderif some of the same select few bull and bear be the same entity just post bs back and forth but then again the joint just kick in ,2024-10-10,DJT,3
CryMeATicker,erudite maga put the finishing touch on his debate club speech ,2024-10-10,DJT,5
CoIumbo,democrats throw explosive at federal officer in an effort to overthrow the usa,2024-10-10,DJT,1
Forthill,immigrant eat cat democrats control weatherhow dumb be they wait for new low,2024-10-10,DJT,1
Anthonybarnes4,short look toast the information be out 14 million share short be over 100 of the share available to the public to trade insider 62 institution 22 and dan bongino 10 own 94 of the share squeeezeeeeee ,2024-10-10,DJT,1
Anthonybarnes4,a big thank to all 14 million share short that pay 04 interest daily to borrow short I thank you for my share of that interest payment from my brokerage a nice 1215 return annually just to continue to hold my rum share very much appreciated ,2024-10-10,DJT,5
Anthonybarnes4,14 million share short must go to bed scare every night know that the next gap up be just around the corner while they continue to pay 20 interest just to hold short how do you plan on cover 14 million share when we average 500k share a day that s 28 day to cover good luck long ,2024-10-10,DJT,1
CoIumbo,democrats injure over 200 police officer and set federal building on fire when they attack wasihngton dc in an effort to overthrow the usa liberal will you apologize,2024-10-10,DJT,1
Anthonybarnes4,who do not know the entire tradeable float of 14 million share be all currently short well play short now let see how long you can continue to pay 20 in brokerage interest ,2024-10-10,DJT,1
Anthonybarnes4,oh yea I totally forgotour future vice president file that he own in rum ,2024-10-10,DJT,1
Anthonybarnes4,oh waiti forget 2 lawsuit north of billion each against google set for 2025 rum will be nice and settle for million for each lawsuit for a cool billion in cash please ,2024-10-10,DJT,1
Anthonybarnes4,the people have finally wake up sorry short look like you be toast ,2024-10-10,DJT,1
starbreaker,trump be kill it tonight in read pack arena,2024-10-10,DJT,1
Anthonybarnes4,short will continue to deny that big thing be not happen at rum just to save their massive short position 14 million share or 50 short float give that insider own 60 of the share and yet rum continue to execute million in cash and no debt not to mention that they continue to land big name partner like hard rock and miami dolphin gap fill come soon that you think ,2024-10-10,DJT,1
ScooterMicBooter1984,put your mask back on you american hate camel toe harris love moron go get your 15th booster you boot licker for life trump 2024 ,2024-10-10,DJT,1
jzuyderland,trump be old and demented and wear a dirty diaper I will never vote for he,2024-10-10,DJT,1
happyhouractual,every voter should be a us citizenevery voter should show idevery voter should be verify every sec of state should get off their a and cleanse voter reg list to verified eligible voter list instead of this lazy public sector unconstitutional bs argument,2024-10-10,DJT,1
CoIumbo,hey democrats liberal how come you never talk about the time you attack democracy you attack washington dc and try to stop the peaceful transfer of power you also set historic federal building on fire well liberal can you condemn your attack without do a whataboutism ,2024-10-10,DJT,1
Romulo7,trump faceplant again while try to insult harris intelligence,2024-10-10,DJT,4
CryMeATicker,huge number just overstay legit visa also if you want to solve the perceive problem just arrest the rich republicans who hire they ,2024-10-10,DJT,1
CoIumbo,how be they go hang anyone with a symbolic art piece explain it be only 4 foot tall be you low iq,2024-10-10,DJT,1
CryMeATicker,yep and after the civil right act be pass and nixon implement his southern strategy they all switch to the republican party where the government be put they in jail for insurrection full circle huh ,2024-10-10,DJT,1
minnesota,careful if he s speak tonight you ll be dead in about hour ,2024-10-10,DJT,1
Chanticleer,and on january 6th 2020 you have maga try to hang the vp and overthrow the government ,2024-10-10,DJT,1
CryMeATicker,he really be satan sidekick ,2024-10-10,DJT,1
sifter,its get nautical down florida way prayer for those in peril and the poor pet too,2024-10-10,DJT,5
Phaws,face ityouve get folk on here who d believe trump if he tell they he be actually black,2024-10-10,DJT,1
CoIumbo,in 1868 the usa military have to hang democrats in washington dc for try to overthrow the united states sad,2024-10-10,DJT,4
sattalight,stephen miller be actually the one guy who be dumber and mean than trump but equally delusional,2024-10-10,DJT,1
GoodNewsBull,I hear the hurricane be go to miss fl not just becuase the dem control the weather climate change be a hoax but biden be use the map trump make I mean if the guy you want to vote for potus do something this asinine you still think he s smart then I get nothing leave for you you re too far go,2024-10-10,DJT,1
ForeRight5,now be justify this do the pathetic excuse ever stop,2024-10-10,DJT,1
CryMeATicker,how do this ruskie escape the front ,2024-10-10,DJT,1
Brandoroadster,maga supporter grab these and stuff they up your fact hole before they be go in november,2024-10-10,DJT,1
minnesota,yep trump pull out of deal with no plan as usual iran immediately restart their uranium enrichment when he do ,2024-10-10,DJT,1
CoIumbo,remember that time the democratic party try to stop the peaceful transfer of power in our government by overthrow the country liberal explain,2024-10-10,DJT,5
ForeRight5,be it the same they who control hurricane someone do not know how market work apparently,2024-10-10,DJT,1
CryMeATicker,will the last woman leave maga for the harris campaign please turn out the light ,2024-10-10,DJT,1
GHECKO,they try desperately to sink this below 20 and fail 15 uptick come,2024-10-10,DJT,1
sborovay07,what happen to the deep state the big corps hollywood and the music industry when these executive order be enforce eo 13769 protect the nation from foreign terrorist entry into the united states sign 01272017 eo 13772 core principle for regulate the united states financial system sign 02032017 eo 13798 promote free speech and religious liberty sign 05042017 eo 13803 revive the national space council sign 06302017 eo 13818 block the property of person involve in serious human right abuse or corruption sign 12202017 eo 13848 impose certain sanction in the event of foreign interference in a united states election sign 09122018 eo 13863 take additional step to address the national emergency with respect to significant transnational criminal organization sign 03152019 eo 13885 establish the national quantum initiative advisory committee sign 08302019 part I,2024-10-10,DJT,1
starbreaker,putin endorse harris so not a surprise but even if that story be true which I doubt due to the source trump do nothing wrong its call diplomacy there be zero russian invasion while trump be president,2024-10-10,DJT,3
sborovay07,as ronald reagan once say,2024-10-10,DJT,5
PatsOfButter,cnn report on hurricane fox complain fl be not give enough blue state money,2024-10-10,DJT,1
Mavrick1985,man look like stop loss be hit today do not be fool keep hold ,2024-10-10,DJT,1
Micturate,break trump have a counterweather device he s go to send milton back to mexico ,2024-10-10,DJT,1
Chief_Beachbum,get so drunk take a shot for each trump lie cheer donold,2024-10-10,DJT,1
PatsOfButter,maybe fl should have income tax instead of rely on blue state welfare,2024-10-10,DJT,1
JJBurch,this be too good lol,2024-10-10,DJT,2
CoIumbo,its always be know even before harris be vice president she be an alcoholic in fact she talk like she have wet brain anyway there be plenty of video of she appear in public and talk while drunk here be the most recent my question liberaldo you think this be good or bad to have someone who want to be president who be drunk all the time not a single communist liberal have have the gut to say its bad why ,2024-10-10,DJT,1
CarlBnas,cry in jesus,2024-10-10,DJT,5
OrangeDirt,only a corrupt fool would spread disinformation about fema when million of people be at risk screw trump to the wall,2024-10-10,DJT,1
S2b,just a gentle reminder trumpie its the prosecuter v the perp only one candidate be for law and order the other will be bunk with bubba soon,2024-10-10,DJT,4
JenniFUR2,I guess you just have to ask yourself a simple question why do democrats hate americans so much I just do not get it,2024-10-10,DJT,1
bluma520,they finally admit their ffck up and you moron wake possie democrats will still vote for 4 more year of this,2024-10-10,DJT,1
Chief_Beachbum,run away from the coast to avoid the hurricane for a few day and now in a hotel lounge drink with lot of people at the bar rather than argue over what to watch on the tv I suggest we have a shot each time trump lie during his speech so now everyone happy,2024-10-10,DJT,5
JenniFUR2,I m with jd its just wrong to give migrant free housing free food free money free phone while our citizen be die,2024-10-10,DJT,1
starbreaker,right now,2024-10-10,DJT,5
Forthill,love fake christian outrage and support for the grifter,2024-10-10,DJT,1
peter71110,really you want this fukce guy,2024-10-10,DJT,5
Sniper_Trade,target still ,2024-10-10,DJT,4
Gumu2,so the government of the united states direct two major hurricane towards themselves in order to swing its own election k,2024-10-10,DJT,1
Your_next_millionaire,let get some over night money,2024-10-10,DJT,3
CryMeATicker,commence word gurgle ,2024-10-10,DJT,1
CryMeATicker,max be def a ruskie cause irony completely escape he ,2024-10-10,DJT,1
RainbowRhino,if you understand the impact of most recent news you would know it will hit trump very badly during covid many of we be desperate for test kit and desperate for medical help while moron trump be tell we it will go away in april use disinfectant etc and now its known he be send much need medical testing kit to russia I bomb stock with what I have more bombing tomorrow fuck trump and fuck what he represent ,2024-10-10,DJT,1
CryMeATicker,back when redneck be clever I remember watch a guy in a wife beater tshirt in front of the rubble of his house and the reporter be try to get a reaction and he jerk his thumb behind he and go this this be nothing I m married to a redhead I could not believe it hope my fellow floridian survive the night,2024-10-10,DJT,1
Str18BALTStr,mr orban be also the fierce criticfromwithin of the eus staunch backing of ukraine and an ally of former us president donald trump maga traitor proud ,2024-10-10,DJT,1
Bat_Masterson,trump on stage now,2024-10-10,DJT,5
Brandoroadster,anybody here want a hj,2024-10-10,DJT,5
RenDragon,trump bible make in china and cost each wholesale,2024-10-10,DJT,5
Morgo,trump just chill that speech tm we shall rally,2024-10-10,DJT,5
Calicodered,chart run a bit slow here sit at 2060 extend hour 4 hour look nice and promise ,2024-10-10,DJT,4
Brandoroadster,anybody come here for a hj,2024-10-10,DJT,5
GHECKO,last chance moonboy,2024-10-10,DJT,5
CryMeATicker,logic just repeat verbatim prior post wtf ,2024-10-10,DJT,1
wakeupppppp2day,goggle away sleepy head but please dooooo try and wake upggooggllee away but pay close attention to johnie gesture if you do not wake up,2024-10-10,DJT,3
tikibar51,talk about misinformation biden say milton look like the storm of the century at 952 mb it be a big storm but hardly the storm of the century ,2024-10-10,DJT,1
CryMeATicker,he help they punch above their weight no question ,2024-10-10,DJT,5
CryMeATicker,savage but very very true ,2024-10-10,DJT,5
Academia,4 million expect to lose power in florida still call a spade a spade highly ironic that the 2 key battleground state be getting hammer 35 week out guess everyone will need to mailin give their physical address will be destroy I m just guess 1st storm to ever reach cat 5 in less than 24 hrsever 2 major hurricane back to back in less than 3 week both to battle state we break a lot of record and we be push the hell out of the irony pedal to end 2024,2024-10-10,DJT,1
AndrewLonggg,break trump just drop a major hint that vivek ramaswamy will have a significant role in his upcoming administration,2024-10-10,DJT,1
Pigfat,s p a c these usually go to zero,2024-10-10,DJT,1
CryMeATicker,gator gusher and palmetto pounder have commence in n central fla wind start to gust ,2024-10-10,DJT,1
perennialperikneeum,personally I believe the insect have a well probability of survival over we human because they do not utilize politic I may be mistake but I think I m right on this one,2024-10-10,DJT,4
Brandoroadster,since I focus on djt more and more people be realize what a pos trump truly be ,2024-10-10,DJT,5
Toc32,trump the war hawk,2024-10-10,DJT,5
Forthill,trump lose bigly,2024-10-10,DJT,1
PatsOfButter,sign of what s to come,2024-10-10,DJT,5
CarlBnas,in a nation of immigrant claim other people be not real americans be some white supremacy nonsense most immigrant I know work hard to get here and have kid here so care more about america than you do,2024-10-10,DJT,1
kingcakebabyz,hopefully the mms algo allow this trash to fall would not surprise I if it trade sideways until friday ,2024-10-10,DJT,1
Bat_Masterson,lmao,2024-10-10,DJT,3
PatsOfButter,maga as thanksgiving get close remember that your family hate you,2024-10-10,DJT,5
Phaws,trump have to be the chinese russians big assetable to spread misinfo for they,2024-10-10,DJT,5
CarlBnas,when you need a conspiracy theory cult to cope with the world,2024-10-10,DJT,5
gilmeriken,anybody ever tell you you re wrong and weirdly smug about it good luck with the book harris 2024 ,2024-10-10,DJT,1
loveisraelmylife1990,trump will lose the election I be an expert and I predict election since 2000,2024-10-10,DJT,1
Anthonybarnes4,traffic be up 40 year over year and since add ad to video this year rum be already on track to have million in revenue in year 1 this do not even include the launch of cloud service that will kick in soon ,2024-10-10,DJT,1
stockwatcherking,we be witness the impact of climate change in real time hurricane milton be go to forever change the entire western coast line in florida warming ocean temperature be supercharge tropical storm in the atlantic entire coast line be already change and what do the magas say warm temp and high co2 be beneficial not surprising when their cult leader think climate change be a chinese hoax you can not make this shit up ill pray for the maga child anyone see the film idiocracy we be live in it ,2024-10-10,DJT,1
Pigfat,profit margin 10000,2024-10-10,DJT,1
minnesota,misinformation ,2024-10-10,DJT,1
Anthonybarnes4,the writing be on the wall trump be nearly a lock to win short be still in denial that thing be not about to change just note the 14 million share that have pile on and continue to pile on ,2024-10-10,DJT,1
sborovay07,unfortunately it be much too late in this war to educate the braindead who use the alinsky rule for radical as their bible idiot do not even know the word qanon be just a legacy media label from my book the most trusted individual around kennedy be know as the q team the letter 17 in the alphabet speculation reign as to whether lincoln have a similar team trump also have a q team,2024-10-10,DJT,2
JJBurch,the trump bible be a chinese make ripoff the trump bible be manufacture for only in china all of trump talk about stop chinese import be just that talk his daughter receive 100s of chinese patent when she work in the trump white house and donald pay more taxis to china than he do to the united states donald trump be rip off his most ardent christian supporter who pay plus shipping and handling for a chinese communist bible wake up republicans donald trump do not care about you he see you all as human atms ready to dispense cash to the trump family any time they ask,2024-10-10,DJT,1
VikeInvests,wth ,2024-10-10,DJT,5
