Username,Comment,date,Ticker,sentiment
WeedHoppa,the threat the cult complain about continue to come from their own local outlet say that miller be a registered republican,2024-10-14,DJT,1
PadraigDubh,and yet maga believe he sad,2024-10-14,DJT,1
swingprotrades,if you do not like my political rant do not watch this but how can kamala harris keep call herself the candidate of change when she be the sit vp I feel like I m take crazy pill vote for whoever you want but I have to point out how crazy it be ps I know people be go to say trump be the bad candidate of all time and you re entitle to your opinion but he have win the nomination 3 time fair and square kamala have never have a vote cast for she yet,2024-10-14,DJT,1
Chico_the_Dolphin,this guy just fall off the turnip truck trump be their btch and everyone know it they re not our ally and never should be their communist friggen dictatorship harriswalz for the people and the world,2024-10-14,DJT,1
Darkpool4u,about to give the maga worldan orgasmwait for it hereno thank require,2024-10-14,DJT,3
PadraigDubh,map by county population size,2024-10-14,DJT,4
Yieldmaxdefiantthereal1,still in denial about don felon here a fact check,2024-10-14,DJT,1
Justtakingprofits,come flavor toothpaste,2024-10-14,DJT,5
Max22,robert f kennedy jr I m concerned about the health of child and the explosion of chronic disease in our kid that s why I m support donald trump who be committed to make america healthy again maha,2024-10-14,DJT,4
smallfish1,a vote for trump be a vote for putin magat prefer putin over our country you can not make this up,2024-10-14,DJT,1
CjHoover,I m happy just keep go,2024-10-14,DJT,5
Yieldmaxdefiantthereal1,more interesting to know behind close door what putin and his puppet discuss well never know because trump refuse a translator and rely on the russians typical traitor,2024-10-14,DJT,3
TreasureBonanza,for all the dem pretend to care about the border because its election season we do not need a new border bill we need an admin that would not undo trump border policy include stay in mexico if they keep trump border policy their would not be a need for any further bill,2024-10-14,DJT,3
GorillaTicTacs,I have maga be fake news sucker on mine so it all work out same dude that bring you the laughably bad affidavit be now bring you the laughably bad email exchangeswith the cursor still visible where he type it himself,2024-10-14,DJT,1
Max22,rfk jr launch where citizen all over the country can post policy proposal that trump team will review,2024-10-14,DJT,5
Clowntown_1,real talk who would anyone rather talk with putin xi kim one on on door close trump or harris trump tell taliban leader touch a hair and nothing open your lib eye,2024-10-14,DJT,1
Yieldmaxdefiantthereal1,unless you buy three month ago you d still be 15 percent down but you know that,2024-10-14,DJT,1
Chawkes,thank for make my call,2024-10-14,DJT,5
SammyStocks22,I mean I sell to lol,2024-10-14,DJT,1
swingprotrades,overnight trading scum libtard,2024-10-14,DJT,3
Darkpool4u,dark magause same blueprintthey need paramountto complete the job at a secret meetingplan have be okdtake a good look at the symbol xwhat drive it remind you of,2024-10-14,DJT,4
22Shares,not sure who be play but I do have walz be a pedophle on my bingo card,2024-10-14,DJT,3
starbreaker,30 second ago,2024-10-14,DJT,1
Clowntown_1,I m sorry but if you do not think kamala be a complete idiot bless your heart kamala or trump behind big door with dog like putin or xi stop,2024-10-14,DJT,1
dhood3,for the un initiate libtard this have be go on for year its not no one want they do not want to pay minimum wage,2024-10-14,DJT,1
Stocktrader1234,trump have 4 yrs to come up with an immigration plan as well as a boarder bill he do not america need thing to get do red state actually get the most out of biden infrastructure bill talk about the deficitnot one red state return a covid monie djt say covid would magically go away if a president care about americans he do not play politic when its in the interest of the who country america be more than land its the people the be to many that give their life for this land now djt in rallys say he be willing to use the military against americans of his choice there s no more o he do not mean what he say he need more time away from government,2024-10-14,DJT,1
Justtakingprofits,penis lover punk bitch,2024-10-14,DJT,1
SammyStocks22,why do this dude keep comment and reshare his own stuff,2024-10-14,DJT,1
Wuptich,90k tradet overnight in 1h,2024-10-14,DJT,1
Justtakingprofits,wait little b,2024-10-14,DJT,3
P451,mondayeod,2024-10-14,DJT,3
ripztrip,the democrat mayor of dearborn michigan be endorse and pal around with hezbolla terrorist supporter this be america less than a month before the next prez election hell fuck no kamala and these dumbass tds dem,2024-10-14,DJT,1
PadraigDubh,a song about american women rightswhich they once hadbee take away by an intrusive government rock on stevie,2024-10-14,DJT,4
Nobody000,we could see a per share,2024-10-14,DJT,3
SammyStocks22,my big financial mistake right now be that I do not buy enough,2024-10-14,DJT,1
dhood3,I once work for a company who hire hundred of migrant to work in their factory yet they do not hire any of they to work in the corporate office unless it be a janitor yet I find myself think how the wage and environment would be different if americans be hire for those role,2024-10-14,DJT,3
Justtakingprofits,can you do the math since you do not have tooth its not natural it be at 18 and not its at so what be the marh,2024-10-14,DJT,2
swingprotrades,the national border patrol council have endorse donald trump for president on behalf of the 16000 man and woman represent by the national border patrol council we strongly support and endorse donald j trump for president of the united states,2024-10-14,DJT,5
Wuptich,if we break 2650 and last week high of 2774 it will go up to 2835 usd depend on how the technical chart look we can also reach 4045 usd this week maybe even 50 usd and overtake jd,2024-10-14,DJT,1
Jokerjoker,your down to six post an hour how you go to save your overpay government job at that rate,2024-10-14,DJT,1
Yoshiepie,viva la migra,2024-10-14,DJT,5
SammyStocks22,I be 600 in the last week mainly because of this stock I buy call but damn,2024-10-14,DJT,3
Justtakingprofits,with your,2024-10-14,DJT,5
Eireternal,lol nebraska trump rally goer be leave behind while trump leave on his private plane,2024-10-14,DJT,1
Justtakingprofits,lie cheat or steal we be republican,2024-10-14,DJT,1
Darkpool4u,dark magaha a plannext victimsparamount shareholder,2024-10-14,DJT,5
Justtakingprofits,true dat,2024-10-14,DJT,5
TDawg2FO,interesting reading,2024-10-14,DJT,4
Justtakingprofits,lie cheat or steal worthless father and mother so do not ask for an explanation from your daughter,2024-10-14,DJT,1
Darkpool4u,dark maga akaasus oligarchsplan to turn the us populationinto perpetual servitudenot own shitincludingthepoorly educatedidiot that support they and help they gain powerputin will supply the blueprint,2024-10-14,DJT,5
Justtakingprofits,if you lick it i d might give you 3 in your a o drought it,2024-10-14,DJT,3
ScoreKeeper_,who else follow obi alert,2024-10-14,DJT,1
swingprotrades,here be more scum libtard,2024-10-14,DJT,2
ScoreKeeper_,he be the topic all month log,2024-10-14,DJT,5
Justtakingprofits,the ball sucker of sweat he be and proud of it,2024-10-14,DJT,5
SammyStocks22,this stock be a no brainer even if you do not like he,2024-10-14,DJT,1
Niceday2022,do anyone see this be this true,2024-10-14,DJT,5
DeepValueFinders,already up 3 in overnight trading everyday the float get small and small and the gain will multiply as no one be sell until election result be in show a victory 80 of the float be own by insider and trump,2024-10-14,DJT,1
Justtakingprofits,give we right to putin your a fucking o,2024-10-14,DJT,5
SteveStreet,magas be singe this gem yesterday,2024-10-14,DJT,5
Yieldmaxdefiantthereal1,I d tell you to read but magat not their strong suit so look at the picture notice all the blue as in blue whitethen red,2024-10-14,DJT,3
swingprotrades,read and weep scum libtard,2024-10-14,DJT,1
TreasureBonanza,ok kamala claim it would have stop the flow of migrant that be a lie it allow 5000 migrant per day 5000 x 365 1825000 new migrant per year how on earth do that stop the flow if the majority of both side agree then it would have be pass but it be not your savior kamala be not the answer she s the problem,2024-10-14,DJT,3
Yieldmaxdefiantthereal1,no question please,2024-10-14,DJT,3
Justtakingprofits,sammy you get tooth,2024-10-14,DJT,5
Justtakingprofits,going suck he dry with toothpaste wisdom,2024-10-14,DJT,1
Stocktrader1234,if the boarder be a national security problem then djt congress should pass this bill its obvious that the wall fail that mexico do not pay for it,2024-10-14,DJT,1
Yieldmaxdefiantthereal1,man I m agree no one who let that many illegal in via m open border during their administration should ever be president,2024-10-14,DJT,1
SammyStocks22,I hear trump be go to be on joe rogan before the election can anyone confirm this,2024-10-14,DJT,1
Justtakingprofits,megan kj elly bleed pus be go to lose it all the dammmm bleed shit,2024-10-14,DJT,1
Chico_the_Dolphin,its a good bill that the majority of both side agree to and kamala be go to pass that mfkn bill because its reasonable and set in motion a system that can be control and improve upon magat have no fkn clue what they re talk about when it come to immigration no clue,2024-10-14,DJT,4
Justtakingprofits,trump say megan my ell to be bleed from everywhere god dammmm s he e be of,2024-10-14,DJT,1
PotionX1900,the devil be alive,2024-10-14,DJT,5
22Shares,with ballot print and early voting start how will walz be remove,2024-10-14,DJT,1
Justtakingprofits,bledde,2024-10-14,DJT,1
dhood3,she sound like a say americans should know his cholesterol level and they can not figure out why she be drop in the poll,2024-10-14,DJT,1
Justtakingprofits,megan kelly the blessing bitch from republican hell by trump,2024-10-14,DJT,5
Yieldmaxdefiantthereal1,you forgot to check legitimate polling ill help you,2024-10-14,DJT,1
Darkpool4u,isellisonalso dark maga,2024-10-14,DJT,3
Justtakingprofits,megan be bleed she be bleed from everywhere,2024-10-14,DJT,1
peter71110,hilarious,2024-10-14,DJT,5
TreasureBonanza,no parroting here I read it it let in 5k migrant per day that s not a comprehensive border plan I know you do not read it though,2024-10-14,DJT,1
Yieldmaxdefiantthereal1,who control the house who negotiate the bill hint republican senator james lankford,2024-10-14,DJT,1
Gibby33,you forgot to add va and mn to the red column,2024-10-14,DJT,3
Justtakingprofits,who care obviously,2024-10-14,DJT,3
TreasureBonanza,I m with you bro I be a dem year ago until they become the party of censorship foreign war push lgbt idealogie on child burn city and the list go on if the dem party be still the classical liberal party of jfk i d be a dem but the have go too far left and quite frankly nutty,2024-10-14,DJT,2
Justtakingprofits,hotto prove it,2024-10-14,DJT,5
Justtakingprofits,hot to prove it hotto,2024-10-14,DJT,5
Chico_the_Dolphin,hmmm maybe read it see who support it and why and then make your own decision instead of parrot idiotic slogan from fox news and trump,2024-10-14,DJT,1
Vedds78,soon who s in there now,2024-10-14,DJT,5
SammyStocks22,I hang out with a lot of hispanic legal voter today who vote against trump in the last 2 election and they all say enough be enough and be vote for trump that s happen everywhere,2024-10-14,DJT,1
Justtakingprofits,penis love live,2024-10-14,DJT,5
Stocktrader1234,there s no debunking this bob woodward have a new book out try debunk it djt would have sue he by now if it be not true,2024-10-14,DJT,1
Yieldmaxdefiantthereal1,goputin party,2024-10-14,DJT,4
Darkpool4u,globalwill be the next x plan have be lay to eliminate all shareholdergo privaterussian oligarch might be involvedsource confirmit all,2024-10-14,DJT,1
Justtakingprofits,little fagot boy word up little bitch,2024-10-14,DJT,3
Yieldmaxdefiantthereal1,what have democracy get to do with assassination attempt oh yeah 2nd amendment magat be weird,2024-10-14,DJT,1
swingprotrades,scum kamala plan for the usa,2024-10-14,DJT,3
TreasureBonanza,hmmmm maybe because the border bill that they want to pass actually say it would allow 5000 migrant in per day lol that do not sound like a serious border bill,2024-10-14,DJT,1
TreasureBonanza,they do not because 28 of they support it maybe even more that do not admit it in the survey its really crazy to act like the party that s pro democracy and support this,2024-10-14,DJT,1
Btcinvestoram,trump may win   washington if poll be any guide and there be many question about they republican presidential nominee donald trump be in well shape now than he be at this time in 2020 and in his win white house campaign of 2016 yes trump trail democratic presidential nominee kamala harris in most poll but the allimportant caveat be that he s down against the incumbent vice president by small margin than he face in his first two general election both of which see he score higher with actual voter than the one who respond to pollster,2024-10-14,DJT,3
Stocktrader1234,djt still have some train thinking he win 2nd term,2024-10-14,DJT,3
Chico_the_Dolphin,how do you explain trump and maga gop kill a comprehensive bipartisan border bill so they can use the issue as a political weapon its okay soon well have actual adult run our country again,2024-10-14,DJT,4
SammyStocks22,kennedy be a democrat and I believe he be an awesome president I be a trump supporter and not a republican party supporter but it should say something to everyone when people actively try and off someone,2024-10-14,DJT,5
yamahagriz700,200 day move average on the yearly have this at 35 just say,2024-10-14,DJT,3
Justtakingprofits,take the real thug up the a o you nasty b you,2024-10-14,DJT,5
humberto,take politic aside I m here to make money if trump lose the election on nov 5 how much would this stock fall,2024-10-14,DJT,1
SammyStocks22,another assassin geez I wish democrat would come out in full force and disavow this kind of shit,2024-10-14,DJT,1
Justtakingprofits,the thug come in your ao be go to to be presidente,2024-10-14,DJT,5
Justtakingprofits,my trigger please foo,2024-10-14,DJT,1
Jadam8,open up at 30 please,2024-10-14,DJT,1
TreasureBonanza,who need ai when you get the real thing lol,2024-10-14,DJT,1
Gibby33,how do you explain the million of illegal alien that the democrats welcome into our countryillegally,2024-10-14,DJT,1
Wuptich,open 2627 usd,2024-10-14,DJT,1
Justtakingprofits,lie cheat or steal the republican way would you expect anything other then that,2024-10-14,DJT,1
Darkpool4u,orange man suggest interment campsfor all those that oppose himputin have volunteeredto supply advisor,2024-10-14,DJT,1
SpencerF,sorry lib the great depression have be cancel,2024-10-14,DJT,1
Stocktrader1234,its go to be like 4th of this jan 6th the sound of popping will be head come out their rear end mark your calendar the train be just around the bend,2024-10-14,DJT,1
Max22,make america healthy again,2024-10-14,DJT,5
BigDaddyBoss,they be in full blow panic and desperation tds at its maximum strain start the na na na na na na na na hey hey hey good bye clock be wind down the end in three week she have no chance,2024-10-14,DJT,1
Darkpool4u,right wing world leader aim to turn cbsinto anotherrt plan have approval of all we right wing oligarchssimilar to what happen to twitter,2024-10-14,DJT,1
Chico_the_Dolphin,if you do not take the advice of 40 out of 44 expert in their field no matter the subject you probably have for s,2024-10-14,DJT,3
Monn1985,already 3 up in the overnight market now tomorrow will be a big day folk and until november 5th,2024-10-14,DJT,5
Noobsaucer,its incredible how many iran and north korean funded troll post here pretend to be americans say a lot,2024-10-14,DJT,5
allstarcharts,look at industrial on an equallyweighte basis make new alltime high relative to the equallyweighted sp500 new high score be that bad,2024-10-14,DJT,2
DeadcowX,again by wen,2024-10-14,DJT,5
Gibby33,you know you re in a cult when you think let million of illegal alien across the border in a clear effort to destabilize the united states of america be ok,2024-10-14,DJT,2
22Shares,come from the person who tell we biden be fine do this mean we ve move on from the taxis now,2024-10-14,DJT,3
swingprotrades,defend scum kamala policy you libtard,2024-10-14,DJT,1
ForeRight5,yea I have a question do you know you re in a cult and just not care or be you unaware,2024-10-14,DJT,1
WeedHoppa,and what do we call this fat tub of lard,2024-10-14,DJT,5
Trumpisourlastchance,only thing kamala harris have in common with great woman leader be she s a woman nothing else and even that be questionable,2024-10-14,DJT,5
Gibby33,gonorrhea victim,2024-10-14,DJT,1
Stocktrader1234,when djt 1st campaign he say that do not need anyone money fast forwardhe just take it the one he take it from complain the most the rich sure do not need a tax cut anymore,2024-10-14,DJT,1
ThinkYouCan,what trump do to his supporter in the desert after the coachella rally be what hell do to america he do not give a fuck about you,2024-10-14,DJT,1
ThinkYouCan,trump leave his supporter strand in the desert,2024-10-14,DJT,1
lombardo141,so maga claim biden be deny hurricane relief to red state which be a lie but at the same time trump say he will deny assistance to california if there be a fire and silence from maga some even cheer and when we say trump be the one spew hate and violence they close their ear amazing,2024-10-14,DJT,1
blake2349,this will probably touch b4 election,2024-10-14,DJT,3
FingerlessRage,well third strike for the dem today,2024-10-14,DJT,5
PatsOfButter,the next three week will target age mental capacity and poopy pant,2024-10-14,DJT,2
Justtakingprofits,fuesad,2024-10-14,DJT,3
TestacularTommy,market look open tomorrow,2024-10-14,DJT,5
SopranoTony,this be really what trump need to do to win would be do it,2024-10-14,DJT,5
PatsOfButter,soon,2024-10-14,DJT,4
Justtakingprofits,worthlesspos,2024-10-14,DJT,1
Yieldmaxdefiantthereal1,I believe you you be there ill take that number glad you re safe be it true the return trip bus be few and far between that s the story I m get,2024-10-14,DJT,1
Justtakingprofits,woman laugh at his p too,2024-10-14,DJT,1
Yieldmaxdefiantthereal1,keep try you ll maybe one day get something right and at least the bulk of the rescue plan benefit go to average americans oh but magat only like socialism in florida right lmao,2024-10-14,DJT,1
biasedOne,so the guy who want to put illegal immigrant and his opponent to death be not a fascist interesting also he shit his pant so,2024-10-14,DJT,3
lombardo141,a couple of republicans bias poll and maga think they wine its go to very interesting in a few week a convict felon that poos in his pant sell chinese make bible and watch sell crypto and milk his fan for money how this election be close be insane maga definitely not a cult,2024-10-14,DJT,1
SopranoTony,this how be trump could win trump could literally get onto kick or rumble and live stream live in 3 state not his own with his supporter who make under a year for 3 night each so he say with a family in north carolina for 3 night he stay with a family in georgia for 3 night he stay with a family in pennsylvania for 3 night he wake up cook clean help out with chore bro he would win in 3 second honest to god stream it its game over,2024-10-14,DJT,1
Kream,bro it be a huge field in the middle of nowhere the parking lot be 4 mile away and we be bus to the rally site the field do not have a capacity limitit be just a big open space where trump give his speech,2024-10-14,DJT,1
PatsOfButter,maga who could come out against trump that would change your opinion to answer your question for I if obama and biden come out and say do not vote for kamala she s a threat to democracy I would not vote for she,2024-10-14,DJT,1
blake2349,I just do not see loyal bull sell I do not see loyal dem cover short either lol,2024-10-14,DJT,1
All4thedough,the rally from to in november will be the problem be this stock be worth more if he lose,2024-10-14,DJT,3
CryMeATicker,sick of taxpayer have to pay for all these incarcerate republiban criminal,2024-10-14,DJT,1
Justtakingprofits,yup rogan have a part for trump everyone be come in trump,2024-10-14,DJT,5
channelsurfer,on the overnight,2024-10-14,DJT,4
channelsurfer,the next endorsement,2024-10-14,DJT,5
yamahagriz700,30 this week,2024-10-14,DJT,5
LogicalTrading,then,2024-10-14,DJT,2
lombardo141,keep sip the cope,2024-10-14,DJT,3
Justtakingprofits,young toothpaste le esfool,2024-10-14,DJT,3
TreasureBonanza,imagine be so brainwash that you actually think the person kamala who cast the tiebreake vote for the american rescue plan which spike inflation to multi decade high will lower cost,2024-10-14,DJT,1
CryMeATicker,its the nazi that surround he like childhood permanently damage vance that represent the real enhance threat,2024-10-14,DJT,1
onesurfed,consider the history of coachella and bracero program or migrant labor and its existence at the core of the region prosperity its rich that trump want to deport people or give they 10 year in prison 20 year next time and death the third time I say same for trump on any visit to california,2024-10-14,DJT,1
Stocktrader1234,100000 he say that but you do check the art of a con be to have other believe it carry it actually believe it djt have now be fact check for over 4000 lie,2024-10-14,DJT,1
Max22,russell brand just hear robert kennedy jr describe how he will revolutionize american healthcare and annihilate big pharma no wonder he be censor and attack he could truly change america,2024-10-14,DJT,5
BigWurm,this be what they re buy number from june 2024 net income 1637 m,2024-10-14,DJT,5
MrWiseMan,game on,2024-10-14,DJT,5
Chawkes,should not that be don be shit his pant and smell really bad new product for when you smell like trump buy this,2024-10-14,DJT,1
swingprotrades,here be the policy of flip flop lie scum kamala defend her libtard,2024-10-14,DJT,1
Max22,a message from robert f kennedy jr there s nothing more profitable than a sick child insurance company hospital big pharma they all make money when a child have a chronic disease the early a kid get sick the big the profit,2024-10-14,DJT,1
DeepValueFinders,they be throw up hail mary like no other and its fall flat as no one believe the dem media propaganda lie anymore no one care about jan 6 whoever be advise kamela campaign be give her bad advice,2024-10-14,DJT,1
Max22,whistleblower expose lyme disease as potential bioweapon in interview with robert f kennedy jr,2024-10-14,DJT,4
Justtakingprofits,ya that s the ticket you fn loser pos loyalty go e wrong,2024-10-14,DJT,1
Superdog808,this guy just lie on the daily and you guy be totally okay with it for some reason he just make shit up,2024-10-14,DJT,3
Max22,start the nuremberg trial now,2024-10-14,DJT,5
Justtakingprofits,yup shit out and shit out be just that shit,2024-10-14,DJT,1
blake2349,this be probably about to run uncle don be close strong kamilla be lose momentum,2024-10-14,DJT,1
CryMeATicker,yep loser go to lose,2024-10-14,DJT,1
Stocktrader1234,california have stiff gun law ammo gun can not be transport load by any civilian let cut the drama djt will sell more unless merchandise that s make in chinamaga will be complain more about the cost of good,2024-10-14,DJT,1
allstarcharts,this week close at new alltime high relative to the dow jones transportation average I ve notice most people do not realize that uber be add to the dow transport in february when they kick out jet blue,2024-10-14,DJT,3
CryMeATicker,trickle on theory,2024-10-14,DJT,5
PatsOfButter,clip of trump soil himself,2024-10-14,DJT,1
Yieldmaxdefiantthereal1,in fairness I would say wayne football injury that keep he out of the nfl have something to do with it don felon play baseballnot well,2024-10-14,DJT,3
Jumpytermite,if you guy love he so much why do you keep try to shoot he,2024-10-14,DJT,5
Justtakingprofits,indeed,2024-10-14,DJT,5
Justtakingprofits,proof foo,2024-10-14,DJT,5
onesurfed,let all invest in dementia what could go wrong,2024-10-14,DJT,1
Max22,must watch kari lake be absolutely crush this debate this almost be not even fair,2024-10-14,DJT,1
CryMeATicker,with a cult that buy chinese bible and chinese sneaker anything be possible at least until november then springtime go to be over bigly so bigly,2024-10-14,DJT,1
Yieldmaxdefiantthereal1,15k capacity but 14989 be there illegally,2024-10-14,DJT,1
Justtakingprofits,not that number of sperm want to reproduce another trump be you kid I,2024-10-14,DJT,1
Max22,be go to hire 10000 more border hero,2024-10-14,DJT,1
Justtakingprofits,welp a lot have dump at a low price when be fface go to dump,2024-10-14,DJT,2
CryMeATicker,interesting fact john wayne and cheetolini have something in common beside be hollywood fictional creation during wwii everyone volunteer lie about age and disability to get in the fight but old johnny get a butt load of deferment and never serve,2024-10-14,DJT,3
Kream,hater will say only 4500 people attend the trump rally while trump claim it be 100000both be wrong I be there and the actual crowd be over 30000 the rally take place just outside coachella a city of roughly 42000 people about 28 mile southeast of palm spring for those who do not know coachella valley be a remote desert area so draw more than 30000 people there be a major turnout especially give how isolated the location be trump visit california for campaign fundraising and to show support for republican candidate in key house race,2024-10-14,DJT,1
Yieldmaxdefiantthereal1,no,2024-10-14,DJT,1
Justtakingprofits,I have toothpaste what do that mean,2024-10-14,DJT,5
