Username,Comment,date,Ticker,sentiment
DRClark,a lot of bear have way to much time on there hand here,2024-10-14,DJT,3
Trekki,we need a strong nato to prevent world war 3 trump want a weak nato because that s what putin want harris for,2024-10-14,DJT,1
Trekki,speaker johnson be plan to not allow kamala harris win to be certify guess what president biden will do harris will win bigtime shell be our next president,2024-10-14,DJT,1
byecell,any comment tim I m sure cbs will check it out,2024-10-14,DJT,1
TheQuantumMechanic,101424 spoooky premarket outlook measurement 1 with session candle stick lowhigh amplitude potential note weekend update final,2024-10-14,DJT,3
Bullheahed,you bear be on here blow it up show you all scared shtless and the bull been watch the game and go to bed with my account show this stock up over 2 pre,2024-10-14,DJT,1
starbreaker,who s go to replace walz,2024-10-14,DJT,5
StockMan112909,I wonder how high this will be once we get close to election,2024-10-14,DJT,3
Trekki,trump mind be slowly deteriorate that be why he will not face harris in another debate he s scared hannibal hecter tell he,2024-10-14,DJT,1
starbreaker,nobodys buy that nonsense he s do dozen of rally appearance speak engagement town hall and interview in just the past 2 week,2024-10-14,DJT,1
Devastator311,good fuck the south leach secede and become a 4th world nation,2024-10-14,DJT,4
uyenng25_,look pretty dead to I very weak action still in a very deep downtrend no setup here avoid as there be so many well opportunity need much more time to base out,2024-10-14,DJT,2
bigtex66,who do you guy think win the election harris or trump,2024-10-14,DJT,1
Trekki,trump be slur word at his rally dementia be slowly increase,2024-10-14,DJT,1
FredoDog,with ukraine as a dowry putin allow trump to run in 2024,2024-10-14,DJT,1
Trekki,even fox news sometimes cut off trump with his violent rhetoric trump hate violence fox news agree,2024-10-14,DJT,1
S_Franconi,sign tout auto worker for trump at michigan rally find to be fake report,2024-10-14,DJT,1
FredoDog,be it meth again tonight or a syphilis flareup,2024-10-14,DJT,3
S_Franconi,neil armstrong first man to walk on the moon july 21 1969 donald lie be more outrageously moronic each day,2024-10-14,DJT,1
sborovay07,the third time be not their charm run out of option as kamel expose her stupidity case against the president evaporate and americans wake up to the evil of diddy and the white rabbit of the elite,2024-10-14,DJT,1
S_Franconi,us border agent habitually abuse human right report reveal this article be more than 1 year old report show lack of accountability for misuse of lethal force intimidation sexual harassment and falsify document,2024-10-14,DJT,1
PadraigDubh,trump know word,2024-10-14,DJT,5
forgottenchuck,even newsweek,2024-10-14,DJT,5
Trekki,poll be lie harris have a very large support from black americans kamala harris will win by a landslide,2024-10-14,DJT,1
Autumn34,what s your source she can not even do a serious interview,2024-10-14,DJT,1
FredoDog,a maga sissy block humblewarrior run and cry after having neuter herself for trump she s even brag about it,2024-10-14,DJT,1
NickyLikesTurtles,let see short cover I smell gamma squeeze this week,2024-10-14,DJT,1
Trekki,can any magas here tell I why trump be a chicken he can not walk the talk an so he hide from vice president kamala,2024-10-14,DJT,1
sKamalaRCX2017,people wake up,2024-10-14,DJT,1
sKamalaRCX2017,robert deweirdo be scared,2024-10-14,DJT,3
Trekki,convict trump be lose his mind he see hannibal lecter attack he press the nuclear button and send it to china world war 3 start from a guy who get fementia,2024-10-14,DJT,1
S_Franconi,ice release we citizen 18 wrongfully detain near border,2024-10-14,DJT,1
S_Franconi,judge find cbp falsely imprison we sibling at border,2024-10-14,DJT,1
GorillaTicTacs,you still push that bs from the know fake news mill same mill that produce the laughable affidavit,2024-10-14,DJT,1
S_Franconi,ice have release this dallasborn us citizen detain for more than three week,2024-10-14,DJT,1
ScoreKeeper_,everybody speak on this guy now,2024-10-14,DJT,5
S_Franconi,washington man illegally detain by border patrol at spokane greyhound bus station sue the agency for damage,2024-10-14,DJT,1
GorillaTicTacs,sothe thing trump do and the thing biden do the opposite trump print money and spend like a drunk sailorand kill income biden deficit spending be much reduce and the printing be greatly contract soyeahthat literally what happen,2024-10-14,DJT,1
S_Franconi,gerardo vazquezmentado an oswego county resident store owner and naturalize we citizen sue the federal government after he be wrongfully arrest and detain by border patrol agent,2024-10-14,DJT,1
S_Franconi,cbp falsely imprison 9yearold we citizen during 34hour interrogation san diego judge,2024-10-14,DJT,1
HumbleWarrior,feel great block 10 libturd here,2024-10-14,DJT,5
S_Franconi,border patrol officer falsely imprison 9yearold us citizen judge rule,2024-10-14,DJT,1
S_Franconi,a new report detail border patrol cruel and unnecessary confiscation and destruction of migrant belonging include medicine legal document and religious object,2024-10-14,DJT,1
JAHBULON,stock market open on federal holiday must be the mandella effect,2024-10-14,DJT,5
S_Franconi,the devil behind the badge the horrifying twelve day of the border patrol serial killer,2024-10-14,DJT,1
S_Franconi,former custom and border patrol agent find guilty of federal civil right and kidnap charge for sexually assault and abduct minor victim,2024-10-14,DJT,1
VikeInvests,be these fake too,2024-10-14,DJT,1
Trekki,why convict trump be a chicken why be he afraid to face vice president kamala harris if it walk like a duck quack like a duck it must be a duck trump be scared of harris chicken,2024-10-14,DJT,1
JAHBULON,stage any fool can see that now madmaxworldtvwatchid670,2024-10-14,DJT,5
VikeInvests,trump leave his supporter at the rally and somehow its everyone else s fault who organize this circus organize be probably the wrong word he s do this at his rally before be they all conspiracy,2024-10-14,DJT,1
Wuptich,there be no share to short which be necessary and there be too few sale,2024-10-14,DJT,1
sborovay07,as the appeal court in ny be about to drop the case go back to the corrupt judge ask why accounting charge be bring up to a felony along with most of the 34 charge have be dismiss in ga as fanny have be expose and smith grasp at straw to renew his deep state case against trump hater be run out of fallback and soon will be expose along with their emperor who have no clothe finally the 3rd attempt president trump fail and as time run out their option to deal the final blow to the republic be run thin,2024-10-14,DJT,1
swingprotrades,for the scum libtard,2024-10-14,DJT,4
JAHBULON,then you go to ukraine and fight,2024-10-14,DJT,5
Trekki,there be no way americans will elect a person with dementia to run usa,2024-10-14,DJT,1
Dieselpro,waltz just get expose for rape a fourteen year old student back in 1995 its unfold now on twitter this be the first post in a long thread harris campaign be finish,2024-10-14,DJT,5
Pattern_Spotter,utterly baffle how two people could screw up so much in so little time a traitor and a bimbo sell out and screw the entire country time to take out the trash,2024-10-14,DJT,1
sKamalaRCX2017,47,2024-10-14,DJT,3
Pipinstallwin,quick dip at open tomorrow before any further run up go to retest maybe only either way will probably be short dip,2024-10-14,DJT,3
Trekki,vice president kamala harris for president,2024-10-14,DJT,4
GorillaTicTacs,well we know what s up with the bus now trump be apparently tired of people walk out of his rally,2024-10-14,DJT,3
sKamalaRCX2017,what s the deal with you sickos spread misinformation you say biden be fine when the guy could not find a bathroom for 4 year,2024-10-14,DJT,1
JAHBULON,easy the defense of our country be priority imagine how much bad it would be if russia invade a small and slightly atypical hurricane be nothing in comparison,2024-10-14,DJT,4
forallthedogs,it do not surprise I it happen in california the big liberal shit hole of a state that allow criminal to walk free,2024-10-14,DJT,1
Trekki,you can not let a man who can not control his temper run a country with his dementia he s just to old trump can not control his temper hell have we all kill,2024-10-14,DJT,1
swingprotrades,explain this scum libtard,2024-10-14,DJT,1
sKamalaRCX2017,weird ass bear finally throw in the towel here now that they ve lose all their money short a 100 run trump be up big in the poll squash their dream of a laugh kamala presidency and million of man in dress,2024-10-14,DJT,1
Darkpool4u,be renameddmsparamount global shareholderswill receive a signeddark maga capin exchange for their sharesand like it,2024-10-14,DJT,1
ycbig176,donald trump be get to the meat and potato of what he think this be about he just ask a crowd if they want a white person or a black person for a president not a smart person or a dumb person this old motherfucker must go,2024-10-14,DJT,1
Justtakingprofits,e watch,2024-10-14,DJT,5
sKamalaRCX2017,seriously wtf be wrong with you get off or on your med,2024-10-14,DJT,1
itsallaboutheoptions,good week yet,2024-10-14,DJT,4
Trekki,I m hear chicken trump be afraid to debate kamala harris convict trump can rape woman when he s alone with they but can not face they when man be around vote kamala harris,2024-10-14,DJT,1
ScoreKeeper_,if your hold any of the four you might want to follow he asap,2024-10-14,DJT,3
SammyStocks22,thing be about this stock be its politically driven and the country have become that but also people know why this stock can do and be not afraid to buy at or more we be only half way to that keep short but you will lose,2024-10-14,DJT,3
ripztrip,let go amish,2024-10-14,DJT,1
JAHBULON,wtf you smoke trump demand blood from nation support immunity for mini tyrant want extreme censorship want war with iran,2024-10-14,DJT,1
Wuptich,eo overnigt over 1 m trade and open 2730 usd way to 354045,2024-10-14,DJT,1
Stocktrader1234,if djt sit on that white couch expect a skid mark do not be cut to a sponsor its important for the public to know the health of the president do he go poop or not go poopthat be the question,2024-10-14,DJT,1
IBOTTheDipAndTheDipWon,hi kid since you do not have much to do but wait for your payday for the rest of your life you should stop by and join the tds mosh pit,2024-10-14,DJT,4
Max22,cathy obrien recount the time she be hunt by elite in a human hunting party by people like dick cheney,2024-10-14,DJT,4
Gemineye,michigander we play an important role get off your ass and vote,2024-10-14,DJT,5
Sevenele,ctvnewscaworldmanwithl maga guy be carry gun,2024-10-14,DJT,1
Darkpool4u,larry ellison invest in dark magas takeoverof twitterparamount global be nexttwitter shareholder get paidthey will not make the same mistake with paramount globalshareholder,2024-10-14,DJT,1
CarlBnas,the cult make up a whole fictional medical condition to squelch any negative mention of their dear leader sorry but only people in your cult care about the tds thing,2024-10-14,DJT,1
Stocktrader1234,all of a sudden djt promise boarder protection so many promise like his fail wallhe have 4 yr of promise,2024-10-14,DJT,1
Ricky_Abelleria,so much tds so little time,2024-10-14,DJT,1
CryMeATicker,wtf maga freakish obsession with fantasy they re go to wake up and smell the coffee alright in november,2024-10-14,DJT,1
CarlBnas,its october buddy if there s so much lie and mislead necessary to support trump then there might be something wrong with the guy,2024-10-14,DJT,3
CryMeATicker,maga well pray cheetolini do not get elect the first thing authoritarian do be remove everyone right start with gun the first guy that say but I m maga will get the rifle butt to the face,2024-10-14,DJT,1
Chris_Pike,mm hmmcali girl attorney general for the state of california she s awesome in so many way,2024-10-14,DJT,5
Ricky_Abelleria,biden harris inflation number vs trump,2024-10-14,DJT,3
JinnySumner,analyst price target for next week livestockmomentumstocksw,2024-10-14,DJT,4
CryMeATicker,sure maga simple start to realize the thought of a prosecutor scare the crap outta maga,2024-10-14,DJT,3
Gemineye,michigan we must defeat slotkin she vote no on this,2024-10-14,DJT,1
CryMeATicker,america win over enemy foreign and domestic,2024-10-14,DJT,5
rredskin,god bless president trump america,2024-10-14,DJT,1
kylevallans,top 5 stock to watch this week full game plan from,2024-10-14,DJT,5
Darkpool4u,dark maga meeting to discussfutureof paramount global,2024-10-14,DJT,4
CryMeATicker,and I hear the british be give up hong kong too,2024-10-14,DJT,1
CarlBnas,nazism,2024-10-14,DJT,1
Justtakingprofits,blood,2024-10-14,DJT,5
Justtakingprofits,fuck woman,2024-10-14,DJT,1
Raygun_24,who here think before nov 5th,2024-10-14,DJT,1
DJTNUMBERONEFAN,the male driver identify as vem miller a 49yearold resident of las vegas be find to be illegally in possession of a shotgun a loaded handgun and a highcapacity magazine miller be a republican politician accord to nevada state record odd how your own people be try to kill you maybe they be not your people and know you re a threat to this country,2024-10-14,DJT,1
Chris_Pike,this be real mahat,2024-10-14,DJT,5
Darkpool4u,be there anyone else who use a skin bronzer to appear godlikeanyone,2024-10-14,DJT,1
Detroit201,and once you drink trump coffee in the morning you will look like our president,2024-10-14,DJT,5
MrACD,trump be use the republican conservative party as oppose to independent label in order to direct the country to an effective revolution usa be no long own by the people due to the indebtedness and the act of 1871,2024-10-14,DJT,1
sattalight,old living american who definitely should not be compare to hitler,2024-10-14,DJT,1
Honest_Abe,yike china make a move before they have to deal with trump move on taiwan much easy operation with the lame duck biden,2024-10-14,DJT,5
Detroit201,make coffee affordable again president trump,2024-10-14,DJT,5
Chico_the_Dolphin,lol they mock everyone that s why we like it get over it grow up and vote kamala stop listen to people who be obviously drunk on kool aid and member of a cult,2024-10-14,DJT,1
Clowntown_1,epic,2024-10-14,DJT,5
Tradewar_elf,good thing trump send those test over to putin in the middle of the pandemic there be a word for this,2024-10-14,DJT,4
VIPTrades009,top watch,2024-10-14,DJT,5
swingprotrades,cost of illegal immigrant per state in 2023 alabama 596 million alaska 130 million arizona 319 billion arkansa 356 million california 309 billion colorado 194 billion connecticut 128 billion delaware 244 million florida 804 billion georgia 314 billion hawaii 771 million idaho 405 million illinois 527 billion indiana 886 million iowa 405 million kansas 603 million kentucky 367 million louisiana 604 million maine 903 million maryland 214 billion massachusetts 216 billion michigan 128 billion minnesota 657 million mississippi 100 million missouri 657 million montana 45 million nebraska 136 million nevada 147 billion new hampshire 108 million new jersey 527 billion new mexico 174 million new york 995 billion north carolina 314 billion north dakota 4325 million ohio 3324 million oklahoma 273 million oregon 147 billion pennsylvania 164 billion rhode island 313 million,2024-10-14,DJT,1
gilmeriken,the convict felon fail former president be a loser,2024-10-14,DJT,1
nastento,libtarddddd,2024-10-14,DJT,3
bluma520,watch this kamala lover,2024-10-14,DJT,5
gilmeriken,delusional just like his supporter harris 2024,2024-10-14,DJT,1
rredskin,good president in my lifetime I m vote for president trump,2024-10-14,DJT,5
Yieldmaxdefiantthereal1,sorry magat have to go do important thing so have a generic fckoff on I,2024-10-14,DJT,1
bluma520,insane to vote for a make up candidate,2024-10-14,DJT,1
Yieldmaxdefiantthereal1,you know its fake when they print she s behind projectsfivethirtyeightco,2024-10-14,DJT,1
IBOTTheDipAndTheDipWon,holy smoke more drunken inanity she need to cut back for her liver,2024-10-14,DJT,1
Pipinstallwin,so trump be launch a crypto coin tomorrow gl,2024-10-14,DJT,1
RobNC,so dumb,2024-10-14,DJT,1
scrappy78,obama and pelosi be lose on purpose only explanation for choose kamala harris over 12 well candidate kamala love read venn diagram on the short bus,2024-10-14,DJT,1
Darkpool4u,be trump bronze makeupout of controlparamount makeup departmentto supply a last coat,2024-10-14,DJT,5
Yieldmaxdefiantthereal1,that and they re pay and in country other than the us we be warn this would happen people sometimes get what they deserve,2024-10-14,DJT,1
Max22,do not underestimate democrat they be like rabid dog back into a corner,2024-10-14,DJT,2
Xaeraiae28,how the fuck do not you republicans and democrats realize that the political spectrum be just a scam I seriously do not understand do you guy just base all your belief on youtube and x while not even research anything every republican I ve meet be as much as a sheep and slave as a democrat bbut trump be get attack by deep state you really think the elite family be dumber than you if all of you dumb motherfucker actually study the political system with an unbiased mindset then you would not even vote the entire government would shut down because everyone would be angry for be lie to all of you be be lie to even republicans who think they know the truth about the world you fake truth seeker can not even comprehend that elite control both side of the political spectrum you re aid the elite and nwo by practice your fake voting right its not hard to research how the electoral college work or any book by freemason or rosicrusion,2024-10-14,DJT,1
swingprotrades,scum libtards longtime democrat donor bill ackman endorse trump cite 33 bidenharris policy he believe could destroy america from within,2024-10-14,DJT,1
Fastruns17,I see a lot of sit at the farm in the heat for 7 hrs at coachella,2024-10-14,DJT,4
DJTNUMBERONEFAN,we be not deal with intelligent people these be moron and I do not mean that just to disparage they I mean it in every sense of the word stubborn stupid low information doorknob licker they literally do not have the mental faculty the average person have they re easily dupe easily manipulate and they re constantly piss the fuck off and look for someone to blame a potent mix,2024-10-14,DJT,1
Fastruns17,how many of you clown get stick walk to your car at the death of trump rally,2024-10-14,DJT,1
Max22,man put obama to the torch,2024-10-14,DJT,1
Ricky_Abelleria,see a couple of book liberal push on 5th grader drawing of oral sex and bad ab1955 take away parental right if a elementary child be trick into transition and you as a parent object the state can take your kid enough be enough,2024-10-14,DJT,1
Justtakingprofits,film food,2024-10-14,DJT,4
soulbrotha,and in the last week trump have tell romney republicans to get the hell out and the people of detroit that the whole country will be like detroit if she get elect I think he want to lose the election,2024-10-14,DJT,1
TJmaximus,kamala fight for taxpayer to fund transgender surgery tampon tim give blowjob to 14 year oldsyou have to be an evil derange dumbshit to support they,2024-10-14,DJT,1
swingprotrades,even saturday night live be mock scum kamala its just too easy,2024-10-14,DJT,2
kamalathegreatborderCzar,oldie but a goodie,2024-10-14,DJT,4
Justtakingprofits,digger please,2024-10-14,DJT,5
Boscomanus,border patrol council endorse trump hahahahahah come on monday let make money,2024-10-14,DJT,1
ScoreKeeper_,I think he s the good to watch,2024-10-14,DJT,5
Justtakingprofits,pervert have freedom in the republican party,2024-10-14,DJT,5
HanksterGangster,stock will be run wild in the premarket after what appear to be yet another fail attempt to take the maga man down by end of next week,2024-10-14,DJT,1
Wuptich,timeline technical,2024-10-14,DJT,4
Yieldmaxdefiantthereal1,have problem with fake news good deflectionnot,2024-10-14,DJT,4
DJTNUMBERONEFAN,trump be a huge narcissist that want everything revolve around he and if its not it must be bad or wrong proof republicans be rino unless they vote for I bible do not make sense unless its the trump bible jews be horrible unless they vote for I debate be useless unless I win they endorsement do not make a difference unless its for I the poll be fake unless I be ahead the election be rig unless I win the news be fake unless its flattering everything a hoax unless I tweet it nepotism be bad unless its my family I m rich but you can not see my taxis I m smart but you can not see my grade I m a patriot but I dodge the draft I m successful but my business fail my staff be the good until I fire they our military be great unless they get kill injure capture or torture I m innocent but the prosecutor and court be corrupt unless they support I,2024-10-14,DJT,1
Runamuk,I love that chart I go to sleep with that chart every night,2024-10-14,DJT,5
rredskin,let goooo vote,2024-10-14,DJT,1
PadraigDubh,neither trump nor his running mate jd vance have disclose their tax filing and there s no sign they intend to though they could shed light on potential conflict of interest and personal stake they have in legislation before congress,2024-10-14,DJT,1
Yieldmaxdefiantthereal1,why do you leave out it soar under trump during his last month except for his last couple week that s the difference here you can not admit anything wrong ever on your side when there s plenty of it biden be not perfect and have bad moment there I write it you ll never ever acknowledge don felon 6 bankruptcy multiple felony conviction fraudulent charity all a matter of public record pathetic biggly,2024-10-14,DJT,1
kamalathegreatborderCzar,everyone beware of instinct and stock insightshe be very hurt by his sell call on djt at 12 buck god bless you lil man,2024-10-14,DJT,1
TJmaximus,tampon tim be a pedophilia,2024-10-14,DJT,1
Honest_Abe,do not hear too much about build back well anymore but I do see a kamala slogan that say a new way forward but in one of the interview kamala say she would not do anything different than biden she do say she be not biden and that be very insightful,2024-10-14,DJT,3
dhood3,my current play tomorrow I m go to buy 10 to 30djt share,2024-10-14,DJT,5
TreasureBonanza,yup and kamala be an actual racist do you hear her fake spanish accent at the univision town hall imagine if trump do that,2024-10-14,DJT,1
PadraigDubh,maga hate american freedoms daddy donnie will take care of they do all their thinking for they,2024-10-14,DJT,5
bluma520,if trump do this he would be call a racist,2024-10-14,DJT,1
TreasureBonanza,screenshot from your fact check article you should read it,2024-10-14,DJT,1
S2b,conald supporter be just so well inform,2024-10-14,DJT,5
Darkpool4u,wanna know where magaand dark maga have theirorigin again essential to have paramountfor total propaganda,2024-10-14,DJT,5
PadraigDubh,and yet his magat still believe he,2024-10-14,DJT,4
swingprotrades,scum libtard here be more,2024-10-14,DJT,2
lasoto3,trump just say he would use the military to target political enemy holy shit this guy straight up say this with a straight face imagine if a dem say this this man can not be allow back in the white house,2024-10-14,DJT,1
DigiDataNomad,this be the same age fred trump be at when he be first diagnose with dementia a couple year later and he have trouble recognize people,2024-10-14,DJT,1
Gemineye,trump have these fucker break biden day one release sanction now he s put they back on you just can not make this stuff up,2024-10-14,DJT,1
bluma520,kamala the manufacturing of a candidate,2024-10-14,DJT,4
Yieldmaxdefiantthereal1,I like this one well but we know millenial do not answer their phone when its an unknown number,2024-10-14,DJT,4
WeedHoppa,ahhthose leave lunatic be try to kill the dear leader so they continue to say another example of their twisted version of the truth,2024-10-14,DJT,1
Max22,must watch harmeet dhillon join tucker carlson to break down kamala harriss entire career history its about what country we want in the next four year video,2024-10-14,DJT,5
FlexLuthor,he leave a bunch of bum strand on the desert,2024-10-14,DJT,1
Yieldmaxdefiantthereal1,and also I would be really wary of anonymous post on x they let anything on there that support fascism since the fascist buy it,2024-10-14,DJT,1
Ricky_Abelleria,bbbut congress we all know biden reverse it on day one,2024-10-14,DJT,1
PadraigDubh,those who know trump well than you be say do not vote for trump,2024-10-14,DJT,1
dhood3,its not significant and its only relevant because she be fall in the poll,2024-10-14,DJT,3
Kream,oof realclearpolitic all poll average show kalama harris leading trump by 17 point on this day in 2016 hillary clinton be ahead by 67 point and joe biden be lead by 10 point use the same method I m certain trump will win in november smug liberal be already prematurely crown kamala harris oblivious to the reality that s come,2024-10-14,DJT,3
bluma520,another major trump support union endorsement trump be go to win,2024-10-14,DJT,5
Justtakingprofits,la hotariacompaasy puta madre check out sammystocks22 on stocktwit,2024-10-14,DJT,5
peter71110,gop politician arrest outside trump rally for illegal possession of gun police,2024-10-14,DJT,1
Max22,robert f kennedy jr watch my interview with and her daughter shayla and learn about the the human cost of kamala harris war on truancy,2024-10-14,DJT,5
Veryn_ice_howmusk,47 day with jesus,2024-10-14,DJT,5
kamalathegreatborderCzar,if this end up be true and verifiedwalz and kamaltoe do no doubt knife in da,2024-10-14,DJT,1
insiderfinancial,this week trading plan cover continue to rebound up 53 last week as trump poll number improve and bet odd move in his favot on watch for monday with moon market video earning thursday always a big mover 19 float short rally after earning have a great week everyone,2024-10-14,DJT,1
