Username,Comment,date,Ticker,sentiment
RenderOut,hey I know you guy be all busy argue like low quality bot but I just need to know if this be go to hit this week or not let I know thank,2024-10-14,DJT,1
toremySo,trump vance 2024,2024-10-14,DJT,5
Yieldmaxdefiantthereal1,sum it up I think,2024-10-14,DJT,5
Yieldmaxdefiantthereal1,yes he be,2024-10-14,DJT,5
TreasureBonanza,the real threat to democracy,2024-10-14,DJT,5
Max22,longtime democrat donor bill ackman sound the alarm and list 33 bidenharris and democrat policy that will destroy america from within,2024-10-14,DJT,5
Yieldmaxdefiantthereal1,I m think as he get old and more senile soften up wrong choice to protect,2024-10-14,DJT,2
swingprotrades,scum kamala have an app for illegal migrant to use to help illegally cross the borber vote scum kamala out,2024-10-14,DJT,1
howardlindzon,thank to methink,2024-10-14,DJT,5
RunBMC44,be that diaperdon again,2024-10-14,DJT,5
allstarcharts,trannie hit new 52week high,2024-10-14,DJT,3
Justtakingprofits,how that thug situation come along,2024-10-14,DJT,5
Kilroy_was_here,everyone stop make fun of trump wear diaper and shit himself the man be nearly 80 year old and clearly go senile he can not help it,2024-10-14,DJT,1
Justtakingprofits,what happen to bend over,2024-10-14,DJT,1
w01fgr33n,hi maga how be you you do not have to take america back because it have always be yours america belong to every us citizen no matter who be in office,2024-10-14,DJT,5
DeadcowX,come soon trump brand diaper your gunna need it when everyone dump out their load trump take a loan out I his share as collateral which you will not see in the report until way later,2024-10-14,DJT,5
Stocktrader1234,the upper class get their tax cut ok now the middle class those enter the middle class can have tax cut upper class cut expire next year anyway any complaint on this mean those cut be just not appreciate a waste to pay on the national debt there a lot of young people that will appreciate this I promise,2024-10-14,DJT,3
Justtakingprofits,when reality set in and loyalty end just another cult,2024-10-14,DJT,5
Max22,worsen geopolitical condition could have farreaching effect on human history jpmorgan ceo,2024-10-14,DJT,2
Fragernockling,here be my advice to voter forget party allegiance which candidate do this amazing speech sound like then vote for the other one in november,2024-10-14,DJT,1
Max22,donald trump say he s do the joe rogan podcast,2024-10-14,DJT,5
CryMeATicker,check in on satan workshop how s the battle between good and agolf twitler evil go,2024-10-14,DJT,5
charlottecorday,illegal just have to love we and be kind to we all,2024-10-14,DJT,1
onesurfed,wanna blame hippie in the 60 blame yourself in 2024 just skip to 154 its you,2024-10-14,DJT,1
ycbig176,melania be only 54 year old she know this old nasty dude be go to be dead shortly and she can continue with her life that we all know she be involve in get pic on my phone lol,2024-10-14,DJT,5
swingprotrades,scum kamala give taxpayer fema money to illegal migrant now there be no money for the taxpayer hurricane victim vote scum kamala out,2024-10-14,DJT,1
Yieldmaxdefiantthereal1,you know its bs when it mention trumps afghanistan lmao,2024-10-14,DJT,1
PrincessKissyface,exquisite english nail it,2024-10-14,DJT,5
MisterTim2020,common practice to release your tax record when you re run for president trump refuse because his cpa cook the book for he multimillionaire who pay zero taxis not right the guy be scum period,2024-10-14,DJT,1
PotionX1900,03,2024-10-14,DJT,5
w01fgr33n,this system do not work unless someone be in the sucker seat at all time when they get rid of all the migrant someone have to go in the sucker seat and guess who it will be all the sucker who vote for trump,2024-10-14,DJT,1
Justtakingprofits,the ignorant toothpasteless wonder of the world,2024-10-14,DJT,5
ycbig176,can you imagine what go through melanias mind when this old dude come into her room and have to remove his depend diaper that s full of piss and shit because he stand at the podium for two hour talk nonsense now he want she to make trump happy again disgusting,2024-10-14,DJT,1
Addictedtogod,tim waltzs family support trump the independent candidate support trump elon support trump tulsi support trump but cnn and the view say he s dangerous so you want harris okie dokie,2024-10-14,DJT,1
