News Title,Date,Source,URL,sentiment,search_query
expert say harris trump both present concern regard leadership against china,2024-10-09,KNOE,https://www.knoe.com/2024/10/08/expert-says-harris-trump-both-present-concerns-regarding-leadership-against-china/,1,Trump
former president trump to hold a rally in prescott valley on sunday,2024-10-09,12News,https://www.12news.com/article/news/politics/elections/decision-2024/donald-trump-hold-rally-in-prescott-valley-sunday-arizona/75-557aabb5-bce1-4caa-8ed6-ec09e8b1e244,5,Trump
harris be borrow from republican playbook as she lead trump in new national poll,2024-10-09,CNBC,https://www.cnbc.com/2024/10/08/harris-republican-trump-polls-frank-luntz-.html,1,Trump
trump secretly send we covid test to putin for his personal use during pandemic,2024-10-09,The Telegraph,https://www.telegraph.co.uk/us/politics/2024/10/08/trump-us-covid-tests-to-putin-pandemic/,1,Trump
trump joke they should do a double 25th amendment to remove biden harris on ben shapiro show not a president,2024-10-09,New York Post,https://nypost.com/2024/10/08/us-news/donald-trump-jokes-about-using-double-25th-amendment-to-remove-biden-harris/,1,Trump
melania trump recall donald first flirt with she while on a date with another woman,2024-10-09,New York Post,https://pagesix.com/2024/10/08/celebrity-news/melania-trump-recalls-donald-first-flirting-with-her-while-on-a-date-with-another-woman/,4,Trump
kamala harris leading donald trump in four battleground state poll,2024-10-09,Newsweek,https://www.newsweek.com/kamala-harris-leading-donald-trump-four-battleground-states-poll-1965747,4,Trump
exaide stephanie grisham dismiss melania trump condemnation of jan 6,2024-10-09,The Hill,https://thehill.com/blogs/in-the-know/4922525-stephanie-grisham-melania-trump-memoir-jan-6-capitol-riot/,1,Trump
on the view harris hit at trump callousness in his storm response,2024-10-09,The New York Times,https://www.nytimes.com/2024/10/08/us/politics/harris-the-view-interview-trump.html,1,Trump
on the view harris hammer trump over storm response,2024-10-09,Spectrum News NY1,https://ny1.com/nyc/all-boroughs/news/2024/10/08/lack-of-empathy-on-a-very-basic-level---harris-slams-trump-during--the-view--appearance--announces-new-plan-for-senior-care,4,Trump
why donald trump be really rally in southern california,2024-10-09,Newsweek,https://www.newsweek.com/donald-trump-coachella-rally-california-latino-voters-1965920,5,Trump
trump campaign launch craze attack on woodward over book,2024-10-09,The Daily Beast,https://www.thedailybeast.com/trump-campaign-launches-crazed-attack-on-bob-woodward-over-book-revelations,1,Trump
nothing persuade anyone anymore trump and harris insider get candid about their election fear,2024-10-09,The Independent,https://www.independent.co.uk/news/world/americas/us-politics/trump-harris-insiders-strategists-election-day-polls-b2625936.html,1,Trump
why trump be hold a rally in the california desert week before election day,2024-10-09,Los Angeles Times,https://www.latimes.com/politics/story/2024-10-08/2024-election-trump-rally-coachella-california,1,Trump
why a federal judge appoint by ronald reagan be slam the trump immunity ruling,2024-10-09,MSNBC News,https://www.msnbc.com/deadline-white-house/deadline-legal-blog/supreme-court-trump-immunity-judge-stephen-trott-rcna174539,1,Trump
melania trump open up about her specific dietary preference share what happen during blacktie dinner in japan,2024-10-09,Hindustan Times,https://www.hindustantimes.com/world-news/us-news/melania-trump-opens-up-about-her-specific-dietary-preferences-shares-what-happened-during-black-tie-dinner-in-japan-101728391108302.html,4,Trump
vance seek vote in detroit defend trump auto industry policy,2024-10-09,Michigan Advance,https://michiganadvance.com/2024/10/08/vance-seeks-votes-in-detroit-defends-trumps-auto-industry-policies/,1,Trump
map show where trump maralago be compare to hurricane milton path,2024-10-09,Newsweek,https://www.newsweek.com/hurricane-milton-path-donald-trump-mar-lago-1966047,1,Trump
kamala harris hold record lead over donald trump in new poll,2024-10-09,Newsweek,https://www.newsweek.com/kamala-harris-donald-trump-national-polls-1965695,5,Trump
trump vs harris 2024 poll harris hold onto lead in 3 new poll,2024-10-09,Forbes,https://www.forbes.com/sites/saradorn/2024/10/08/trump-vs-harris-2024-polls-harris-leads-by-2-points-in-latest-survey/,5,Trump
why trump talk about a deal with iran make so little sense,2024-10-09,MSNBC News,https://www.msnbc.com/rachel-maddow-show/maddowblog/trumps-talk-deal-iran-makes-little-sense-rcna174563,1,Trump
breakingview   neither precedent nor trump can save big tech,2024-10-09,Reuters,https://www.reuters.com/breakingviews/neither-precedent-nor-trump-can-save-big-tech-2024-10-08/,1,Trump
why mitt romney   no fan of donald trump   do not plan to endorse kamala harris for president,2024-10-09,The Salt Lake Tribune,https://www.sltrib.com/news/politics/2024/10/08/mitt-romney-no-fan-trump-is-not/,1,Trump
this law school dean sure be associate with lot of trump allege coconspirator,2024-10-09,The Intercept,https://theintercept.com/2024/10/08/mark-martin-trump-co-conspirators-election/,5,Trump
trump speak with putin as many as 7 time after leave office new book report,2024-10-09,USA Today,https://www.usatoday.com/story/news/politics/elections/2024/10/08/trump-putin-calls-talking-bob-woodward-book/75569580007/,1,Trump
