News Title,Date,Source,URL,sentiment,search_query
plane with banner telling trump to watch the apprentice fly near pennsylvania rally,2024-10-11,The Hill,https://thehill.com/blogs/in-the-know/4927482-plane-banner-trump-apprentice-movie/,1,Trump
who do that obama mock trump bible nft grift,2024-10-11,Salon.com,https://www.salon.com/2024/10/10/who-does-that-obama-mocks-bible-nft-grifts/,1,Trump
trump again attempt to prove he be name man of the year in michigan,2024-10-11,The Detroit News,https://www.detroitnews.com/story/news/politics/2024/10/10/donald-trump-attempts-to-prove-he-was-named-man-of-the-year-michigan-oakland-county-republicans/75613710007/,5,Trump
former president trump make chicago stop after speak in detroit,2024-10-11,WGN-TV,https://wgntv.com/news/chicago-news/former-president-trump-makes-chicago-stop-after-speaking-in-detroit/,1,Trump
the grieve mother who be catch off guard when she appear in a trump ad ask the former president to intervene,2024-10-11,Inquirer.com,https://www.inquirer.com/politics/election/kimberly-burrell-donald-trump-ad-restoration-ac-20241010.html,1,Trump
ohio voter dismiss false claim about haitian but trump have slight lead post poll find,2024-10-11,The Washington Post,https://www.washingtonpost.com/politics/2024/10/10/ohio-voters-dismiss-false-claims-about-haitians-trump-has-slight-lead-post-poll-finds/,1,Trump
tiffany trump pregnant with first child former president reveal,2024-10-11,USA Today,https://www.usatoday.com/story/news/politics/elections/2024/10/10/tiffany-trump-pregnant/75612060007/,1,Trump
the latino battleground you have not hear about,2024-10-11,Politico,https://www.politico.com/news/magazine/2024/10/10/trump-harris-town-hall-univision-00183158,5,Trump
biden suggest trump get a life after false hurricane claim,2024-10-11,The Hill,https://thehill.com/homenews/administration/4927034-biden-trump-hurricane-milton-helene-misinformation/,1,Trump
political storm on trump onslaught of lie biden urge former president to get a life man,2024-10-11,Fox News,https://www.foxnews.com/politics/political-storm-trump-lies-biden-urges-former-president-get-life-man,1,Trump
trump boast of genius ability to weave during rally speech I do not ramble,2024-10-11,Fox News,https://www.foxnews.com/media/trump-boasts-ability-weave-rally-speeches-denies-critics-who-say-he-rambles,5,Trump
trump medium share up 100 from recent low as djt rally continue on heavy trading,2024-10-11,CNBC,https://www.cnbc.com/2024/10/10/djt-trump-media-stock-rally-truth-social.html,5,Trump
why donald trump be keep republicans from attack nycs indict dem mayor,2024-10-11,Politico,https://www.politico.com/news/2024/10/10/donald-trump-eric-adams-republican-attacks-00183238,1,Trump
the memo hurricane politic scramble final stretch of trumpharris race,2024-10-11,The Hill,https://thehill.com/homenews/campaign/4927633-hurricanes-political-impact-election/,4,Trump
harris agree to town hall in pennsylvania on date of cancel debate with trump,2024-10-11,Pennsylvania Capital-Star,https://penncapital-star.com/briefs/harris-agrees-to-town-hall-in-pennsylvania-on-date-of-canceled-debate-with-trump/,4,Trump
why trump be cornered obama rally for harris cheney   trump own aide slam he in crucial pa,2024-10-11,MSNBC News,https://www.msnbc.com/the-beat-with-ari/watch/why-trump-is-cornered-obama-rallies-for-harris-cheney-trump-s-own-aides-slam-him-in-crucial-pa-221447749619,1,Trump
trump have shift explanation for why he snub 60 minute cbs news say,2024-10-11,Fortune,https://fortune.com/2024/10/10/trump-60-minutes-explanation/,1,Trump
trump speak in detroit trash detroit,2024-10-11,HuffPost,https://www.huffpost.com/entry/trump-detroit-comments_n_67083d36e4b0c34b3eba601c,1,Trump
e jean carroll lawyer be begin to tussle over trump 88 million judgment,2024-10-11,www.notus.org,https://www.notus.org/courts/e-jean-carroll-lawyers-trump-88-million-judgment,1,Trump
north carolina 2024 trumpharris poll trump overtakes harris lead,2024-10-11,Forbes,https://www.forbes.com/sites/saradorn/2024/10/10/north-carolina-2024-trump-harris-polls-trump-overtakes-harris-lead/,1,Trump
no respite from the storm of trump lie   horsey cartoon,2024-10-11,The Seattle Times,https://www.seattletimes.com/opinion/no-respite-from-the-storm-of-trumps-false-claims/,1,Trump
tiffany trump be pregnant say expresident,2024-10-11,The Hill,https://thehill.com/blogs/in-the-know/4926891-tiffany-trump-pregnant/,1,Trump
trump close the door on additional debate with weird message,2024-10-11,MSNBC News,https://www.msnbc.com/rachel-maddow-show/maddowblog/trump-closes-door-additional-debates-weird-message-rcna174853,1,Trump
trump propose new tax break on car loan interest,2024-10-11,CNBC,https://www.cnbc.com/2024/10/10/trump-car-loan-tax-deductible-harris-election.html,1,Trump
trump tariff could push sp 500 down 10 next year ubs says,2024-10-11,Forbes,https://www.forbes.com/sites/dereksaul/2024/10/10/trumps-tariffs-could-push-sp-500-down-10-next-year-ubs-says/,1,Trump
donald trump chance of win election rise with bookmaker,2024-10-11,Newsweek,https://www.newsweek.com/donald-trumps-chances-winning-election-surge-bookmakers-1967010,5,Trump
fcc chair reject trump call to revoke cbs license over harris interview edit,2024-10-11,The Verge,https://www.theverge.com/2024/10/10/24267054/fcc-chair-rosenworcel-trump-harris-60-minutes-cbs-license,1,Trump
trump slam beta male howard stern over softball kamala harris interview make a fool of himself,2024-10-11,New York Post,https://nypost.com/2024/10/10/us-news/trump-slams-howard-stern-over-softball-harris-interview/,1,Trump
donald trump fema claim attack in home state newspaper garbage,2024-10-11,Newsweek,https://www.newsweek.com/donald-trumps-fema-claims-attacked-miami-newspaper-1967179,1,Trump
disinformation stir by musk and trump add strain to hurricane recovery,2024-10-11,Bloomberg.com,https://www.bloomberg.com/news/articles/2024-10-10/election-disinformation-stirred-by-musk-and-trump-strains-hurricane-recovery,4,Trump
watch trump completely lose train of thought in awkward speech,2024-10-11,The New Republic,https://newrepublic.com/post/187055/donald-trump-loses-train-thought-awkward-speech,1,Trump
trump drive the education debate with big contradictory idea,2024-10-11,The Washington Post,https://www.washingtonpost.com/education/2024/10/10/trump-harris-education-platforms/,1,Trump
us election poll tracker 2024 who be ahead   harris or trump,2024-10-11,BBC,https://www.bbc.com/news/articles/cj4x71znwxdo,1,Trump
nate silver point to good sign for trump in election forecast update,2024-10-11,Newsweek,https://www.newsweek.com/nate-silver-points-good-sign-trump-election-forecast-update-1967278,4,Trump
with 100footwide trump sign a stick company dive into politic,2024-10-11,The New York Times,https://www.nytimes.com/2024/10/10/nyregion/sticker-mule-trump-sign.html,1,Trump
fcc chair rebuke trump call to revoke cbs abc broadcast license,2024-10-11,The Hill,https://thehill.com/homenews/media/4926817-trump-fcc-broadcast-networks/,1,Trump
trump try to convince woman to vote for he after call harris a dummy,2024-10-11,MSNBC News,https://www.msnbc.com/top-stories/latest/trump-women-voters-harris-scranton-pennsylvania-rally-rcna174827,1,Trump
scared donald trump be hide from journalist exobama adviser,2024-10-11,Newsweek,https://www.newsweek.com/donald-trump-scared-hiding-journalists-ex-obama-adviser-kamla-harris-election-1967019,1,Trump
man blame trump and maga cult for fatherinlaw refuse fema help after hurricane helene,2024-10-11,MSNBC News,https://www.msnbc.com/top-stories/latest/helene-milton-disinformation-trump-fema-dan-abrams-rcna174889,1,Trump
trump deliver historically illiterate lecture on tariff,2024-10-11,New York Magazine,https://nymag.com/intelligencer/article/trump-tariffs-detroit-economic-club-history-revenue-smoot-hawley.html,1,Trump
trump double down on china carmaker be unwelcome in us market,2024-10-11,South China Morning Post,https://www.scmp.com/news/china/politics/article/3281934/donald-trump-doubles-down-china-carmakers-being-unwelcome-us-market,1,Trump
new reporting make trumpbrande bible look even more absurd,2024-10-11,MSNBC News,https://www.msnbc.com/rachel-maddow-show/maddowblog/new-reporting-makes-trump-branded-bibles-look-even-absurd-rcna174905,1,Trump
trump mean to weaponize the justice department,2024-10-11,The Globalist,https://www.theglobalist.com/united-states-donald-trump-justice-corruption-united-states-supreme-court/,5,Trump
harris accept invite to cnn town hall as another trump debate appear unlikely,2024-10-11,The Hill,https://thehill.com/homenews/media/4926649-harris-cnn-town-hall-trump-debate/,1,Trump
will nonstop we election ad help trump or harris,2024-10-11,BBC,https://www.bbc.com/news/articles/c4gl013w4e8o,1,Trump
nato boss stop worry about trump,2024-10-11,POLITICO.eu,https://www.politico.eu/article/nato-boss-mark-rutte-dont-worry-about-trump/,1,Trump
opinion trump say hell expel a million immigrant believe he   it happen before,2024-10-11,Los Angeles Times,https://www.latimes.com/opinion/story/2024-10-10/donald-trump-immigration-repatriados-depression,1,Trump
scoop trump ally plan ad blitz around harris viral quote on biden,2024-10-11,Axios,https://www.axios.com/2024/10/09/trump-ad-harris-biden-quote-the-view,1,Trump
opinion   donald trump have a prayer,2024-10-11,WSJ,https://www.wsj.com/opinion/donald-trump-has-a-prayer-st-michael-be-our-defense-history-conflict-church-91d9d003,5,Trump
why donald trump be campaign in colorado a state he can not win,2024-10-11,Axios,https://www.axios.com/local/denver/2024/10/10/donald-trump-aurora-colorado-campaign-stop,1,Trump
