News Title,Date,Source,URL,sentiment,search_query
donald trump under pressure as harris release medical record your turn,2024-10-13,Newsweek,https://www.newsweek.com/donald-trump-kamala-harris-medical-records-presidential-election-1968073,1,Trump
dozen protest in coachella ahead of trumps campaign rally be not intimidate,2024-10-13,The Desert Sun,https://www.desertsun.com/story/news/politics/elections/2024/10/12/trump-coachella-rally-protests/75649094007/,1,Trump
new poll reveal state of trump v harris race in critical battleground states pennsylvania and arizona,2024-10-13,The Independent,https://www.independent.co.uk/news/world/americas/us-politics/trump-harris-polls-election-swing-states-arizona-pennsylvania-b2628333.html,4,Trump
dennis quaid rally with trump in california tell people to pick a side,2024-10-13,KOMO,https://komonews.com/news/nation-world/dennis-quaid-rallies-with-trump-in-california-criticizes-weaponization-of-justice-pick-a-side-us-constitution-tiktok-american-actor-republican-campaign-rally-coachella-kamala-harris-ronald-reagan,4,Trump
opinion   who be these people interview trump and harris,2024-10-13,The New York Times,https://www.nytimes.com/2024/10/12/opinion/harris-trump-interviews.html,5,Trump
trump visit aurora colorado to push migrant claim gop mayor say be grossly exaggerated,2024-10-13,Spectrum News NY1,https://ny1.com/nyc/all-boroughs/news/2024/10/11/trump-aurora-colorado-venezuela-migrants,1,Trump
why vp harris health check be spark debate on trumps fitness for office,2024-10-13,MSNBC News,https://www.msnbc.com/the-weekend/watch/why-vp-harris-health-check-is-sparking-debate-on-trump-s-fitness-for-office-221589061963,1,Trump
harris release excellent bill of health and challenge trump   today news,2024-10-13,mint,https://www.livemint.com/news/world/harris-releases-excellent-bill-of-health-and-challenges-trump-11728773036591.html,5,Trump
with medical report out kamala play health card against trump,2024-10-13,Dawn,https://www.dawn.com/news/1864862/with-medical-report-out-kamala-plays-health-card-against-trump,1,Trump
trump plan cobb county rally ahead of fox news town hall,2024-10-13,FOX 5 Atlanta,https://www.fox5atlanta.com/news/trump-plans-cobb-county-campaign-rally,4,Trump
trump fear for his life week before poll demand we military protection secret service fail,2024-10-13,Hindustan Times,https://www.hindustantimes.com/videos/trump-fears-for-his-life-weeks-before-polls-demands-us-military-protection-secret-service-failed-101728747087181.html,1,Trump
opinion   yes this be what donald trump really sound like no you can not ignore it,2024-10-13,Washington Post,https://www.washingtonpost.com/opinions/2024/10/13/trump-rally-interview-immigrants-lies/,1,Trump
exclusive   trump have clear edge on handle israel ukraine war wsj poll show,2024-10-13,WSJ,https://www.wsj.com/politics/elections/trump-harris-foreign-policy-poll-46540a9a,5,Trump
column kevin de len take a page from trumps playbook at boyle height debate,2024-10-13,Los Angeles Times,https://www.latimes.com/california/story/2024-10-12/kevin-de-leon-takes-a-page-from-trumps-playbook,4,Trump
kamala harriss medical history release as campaign aim to draw contrast with donald trump,2024-10-13,Sky News,https://news.sky.com/story/kamala-harriss-medical-history-released-as-campaign-aims-to-draw-contrast-with-donald-trump-13232422,4,Trump
trump plan to amp up his violent bigote rhetoric in close pitch to voter,2024-10-13,Rolling Stone,https://www.rollingstone.com/politics/politics-features/trump-violent-rhetoric-immigrant-dictator-police-election-2024-1235131086/,1,Trump
fight for house rage in district ring nyc where trump struggle but other republicans thrive,2024-10-13,"ABC News - Breaking News, Latest News and Videos",https://abcnews.go.com/Politics/wireStory/fight-house-raging-districts-ringing-nyc-trump-struggled-114745450,4,Trump
kamala harris excellent health update to challenge donald trump fitness for office,2024-10-13,Hindustan Times,https://www.hindustantimes.com/world-news/us-news/kamala-harris-excellent-health-update-to-challenge-donald-trumps-fitness-for-office-101728745816556.html,5,Trump
trump hold rare rally in california with eye on keep house majority,2024-10-13,The Hill,https://thehill.com/homenews/campaign/4929415-trump-rally-california-house-races/,5,Trump
trump tax cut could expire after 2025 here how topranked advisor be prepare,2024-10-13,CNBC,https://www.cnbc.com/2024/10/12/trumps-tax-cuts-expire-after-2025.html,1,Trump
donald trump to speak at hispanic event as kamala harris releases medical report   live,2024-10-13,The Guardian,https://www.theguardian.com/us-news/live/2024/oct/12/election-donald-trump-kamala-harris-politics-live-updates%3Fpage%3Dwith:block-670a8c4b8f081a18004e5555,5,Trump
trump polarize style be the gop miss opportunity,2024-10-13,The Hill,https://thehill.com/opinion/campaign/4929263-republicans-missed-chance-trump/,3,Trump
watch live trump deliver remark at california rally,2024-10-13,Fox News,https://www.foxnews.com/video/6363185721112,5,Trump
sunday show preview harris trump enter final stretch we recover from hurricane helene milton,2024-10-13,The Hill,https://thehill.com/homenews/sunday-talk-shows/4930469-sunday-shows-preview-harris-trump-hurricanes-helene-milton/,4,Trump
trump supporter hold rally in lincoln park,2024-10-13,Olean Times Herald,https://www.oleantimesherald.com/news/trump-supporters-hold-rally-in-lincoln-park/article_11eee77c-8903-11ef-8b3a-37860b9f5dcd.html,5,Trump
the interview a conversation with jd vance,2024-10-13,The New York Times,https://www.nytimes.com/2024/10/12/magazine/jd-vance-interview.html,4,Trump
billionaire bill ackman clarifie why he support trump over harris in us poll,2024-10-13,India Today,https://www.indiatoday.in/world/us-election-2024/story/us-election-billionaire-bill-ackman-why-he-endrosed-donald-trump-over-kamala-harris-2615991-2024-10-13,1,Trump
trump poise to flip two biden swing state by take his voter back from harris,2024-10-13,New York Post,https://nypost.com/2024/10/12/us-news/donald-trump-poised-to-flip-two-biden-swing-states-by-taking-his-voters-back-from-kamala-harris/,1,Trump
melania trump claim its tricky to trust the government,2024-10-13,The Independent,https://www.independent.co.uk/news/world/americas/us-politics/melania-trump-donald-trust-government-memoir-b2628348.html,5,Trump
trump be in a well polling spot now than he be against clinton or biden,2024-10-13,USA Today,https://www.usatoday.com/story/news/politics/elections/2024/10/12/polls-trump-vs-harris-biden-clinton/75532448007/,4,Trump
exclusive mark cuban on back kamala harris and his concern about trump,2024-10-13,Newsweek,https://www.newsweek.com/exclusive-mark-cuban-backing-kamala-harris-his-concerns-about-trump-1967910,4,Trump
george conway give donald trump backhand compliment,2024-10-13,Newsweek,https://www.newsweek.com/george-conway-backhanded-compliment-donald-trump-snl-nevada-1968091,4,Trump
crockett say trump do not have the ability to tell the truth,2024-10-13,The Hill,https://thehill.com/homenews/campaign/4930386-crockett-trump-truth-msnbc/,1,Trump
doctor deem harris in excellent health her team aim to contrast with trump scant medical info,2024-10-13,Los Angeles Times,https://www.latimes.com/world-nation/story/2024-10-12/harris-doctor-reports-shes-in-excellent-health-her-campaign-wants-to-draw-a-contrast-with-trump,5,Trump
trump team request militarylevel security cite threat from iran,2024-10-13,The Hill,https://thehill.com/homenews/campaign/4930170-donald-trump-requests-military-aircraft-extra-protection-iran-threats/,1,Trump
cnbc host say he will be excoriate for trump win remark,2024-10-13,The Daily Beast,https://www.thedailybeast.com/cnbc-anchor-ross-aaron-sorkin-suggests-another-donald-trump-presidency-could-be-a-ratings-boon,1,Trump
3 nobrainer stock to buy if donald trump and republicans sweep in november,2024-10-13,Yahoo Finance,https://finance.yahoo.com/news/3-no-brainer-stocks-buy-094800155.html,1,Trump
trump have a problem with woman do that include melania,2024-10-13,The Independent,https://www.independent.co.uk/voices/trump-melania-election-kamala-harris-b2627822.html,1,Trump
maga stalwart seek for top trump administration job have a shocking agenda,2024-10-13,HuffPost,https://www.huffpost.com/entry/mike-davis-donald-trump-white-house-administration_n_670a89e1e4b04266ae8512fc,5,Trump
harris outpaces trump in battleground pennsylvania but trail in arizona poll,2024-10-13,The Hill,https://thehill.com/homenews/campaign/4930086-kamala-harris-donald-trump-pennsylvania-arizona-2024-survey/,3,Trump
melania trump you can not always trust the government,2024-10-13,The Telegraph,https://www.telegraph.co.uk/us/politics/2024/10/12/melania-trump-says-you-shouldnt-always-trust-the-government/,1,Trump
poli blast trump over political rhetoric some say its cognitive decline,2024-10-13,The Hill,https://thehill.com/homenews/state-watch/4930021-jared-polis-donald-trump-rhetoric-immigration-political-opponents/,1,Trump
for the second time this year trump campaign choose not to submit an oregon voter pamphlet statement,2024-10-13,KTVZ,https://ktvz.com/news/government-politics/2024/10/12/for-the-second-time-this-year-trump-campaign-chose-not-to-submit-an-oregon-voters-pamphlet-statement/,1,Trump
stephen kings new warning about donald trump take off online,2024-10-13,Newsweek,https://www.newsweek.com/stephen-king-new-warning-donald-trump-detroit-speech-1968121,1,Trump
here how the us election would pan out if australian vote instead,2024-10-13,The Sydney Morning Herald,https://www.smh.com.au/politics/federal/here-s-how-the-us-election-would-pan-out-if-australians-voted-instead-20241010-p5khgi.html,1,Trump
trump campaign request military aircraft and armored vehicle in response to threat from iran,2024-10-13,Military.com,https://www.military.com/daily-news/2024/10/12/trumps-campaign-requests-military-aircraft-and-armored-vehicles-response-threats-iran.html,1,Trump
harris outperform biden with black voter but trump gaining survey,2024-10-13,The Hill,https://thehill.com/homenews/campaign/4930002-kamala-harris-joe-biden-donald-trump-black-voters-survey/,1,Trump
trump be an embarrassment   to himself and to the right,2024-10-13,The Telegraph,https://www.telegraph.co.uk/news/2024/10/12/emulating-trump-suicide-for-the-right-liability-to-west/,1,Trump
opinion   where be the fierce urgency of beat trump,2024-10-13,The New York Times,https://www.nytimes.com/2024/10/12/opinion/trump-harris-election.html,1,Trump
former president trump lead harris by 10 point   polymarket,2024-10-13,Cointelegraph,https://cointelegraph.com/news/former-president-trump-gains-10-point-lead-harris-polymarket,1,Trump
trump campaign respond to mark milley reportedly call he fascist,2024-10-13,Newsweek,https://www.newsweek.com/donald-trump-campaign-responds-mark-milley-calling-him-fascist-1968056,1,Trump
we presidential election 2024 live update trump request military plane increase protection amid security threat   today news,2024-10-13,mint,https://www.livemint.com/news/us-news/us-presidential-elections-2024-live-updates-dates-donald-trump-vs-kamala-harris-11728634396087.html,1,Trump
trump harris ramp up appearance with less than one month until election day late update,2024-10-13,HuffPost,https://www.huffpost.com/entry/2024-election-live-updates_n_6703df77e4b0907cd5a27482,1,Trump
